	Title	Short Description	Location	Price (Euro)	Timestamp	Url Adv	doc_id	similar_docs	num_similar_docs
911	Avviato studio psicologia mette a disposizione stanze 	Avviato studio di psicologia mette a disposizione stanze a professionisti della salute (psicologi, medici, nutrizionisti, counselor, fisioterapisti, ecc). Centralissimo (adiacente Metro Spagna), finemente arredato, silenzioso e luminoso. Pulizie e utenze incluse. Si valuta inoltre possibilità di sinergia professionale 	Centro Storico 	110 	 9 ottobre, 18:01 	https://www.kijiji.it/annunci/stanze-e-posti-letto/roma-annunci-centro-storico/avviato-studio-psicologia-mette-a-disposizione-stanze/143923433	911	{1923, 132, 1285, 2055, 264, 396, 1549, 911, 528, 1681, 1021, 2583, 1175, 537, 1945, 1307, 286, 1439, 2209, 418, 1571, 2341, 2473, 1065, 1835, 2605, 1197, 559, 1329, 691, 308, 823, 2231, 1593, 568, 955, 2495, 581, 198, 1351, 713, 2121, 1483, 845, 2253, 462, 977, 2385, 1747, 1879, 2275, 484, 2407, 999, 1769, 2539, 1131, 110, 625, 242, 1395, 2165, 374, 1527, 506, 1659, 2429, 1791}	68
1000	Negozi C1 in via Caianello, Roma.38/43/50/67Mq. 	Privato affitta negozi vari tagli in via Caianello, Roma. Tutti ristrutturati, serrande elettriche. Citofono esterno e apertura serranda ingresso dall'esterno, con chiave. Locali ideali per studio medico, laboratori/uffici tecnici, di riparazioni, assistenza, o di rappresentanza con deposito. Categoria C1, impianto riscaldamento / condizionamento elettrico. Impianto elettrico a norma con certificazione. Bagno con antibagno. Vicinissimi metro Malatesta e fermate autobus. Garage privato ad ore vicinissimo. Possibilita' finanziamento Microcredito a tasso agevolato 1%. Contratto con applicazione della cedolare secca. Tagli disponibili: 38Mq. 1 Serranda elettrica; locale divisibile in zona ingresso / ufficio/deposito. Bagno con antibagno. Euro 650,00. 43Mq. 2 Serrande elettriche; locale divisibile in zona ingresso / ufficio, deposito, ripostiglio, vano tecnico. Bagno con antibagno. Euro 750,00. 50Mq. 1 Serranda elettrica; locale divisibile in zona ingresso / ufficio, deposito. Porta blindata e grata accesso deposito. Bagno con antibagno. Euro 800,00. 67Mq. 2 Serrande elettriche; locale divisibile in zona ingresso, ufficio, deposito. Bagno con antibagno. Euro 1.100,00. 	Prenestino / Casilino 	650 	 23 settembre, 06:35 	https://www.kijiji.it/annunci/affitto/roma-annunci-prenestino-casilino/negozi-c1-in-via-caianello-roma-38-43-50-67mq/139821434	1000	{1792, 1924, 133, 1286, 2056, 265, 397, 1550, 912, 529, 1682, 1022, 2584, 1176, 538, 1946, 1308, 287, 1440, 2210, 419, 1572, 2342, 2474, 1066, 1836, 1198, 2606, 560, 1330, 692, 309, 824, 2232, 1594, 956, 2496, 582, 199, 1352, 714, 2122, 1484, 846, 2254, 463, 2386, 978, 1748, 1880, 2276, 485, 1000, 2408, 1770, 1132, 2540, 111, 626, 243, 1396, 2166, 375, 1528, 507, 1660, 2430}	67
221	Negozio 169Mq per laboratorio, ufficio, studio a Roma. 	Privato affitta negozio 169 mq, al piano terra, ristrutturato, 4 serrande elettriche, citofono esterno e apertura serranda ingresso dall'esterno, con chiave. Locale diviso in zona ingresso, ufficio, direzione, laboratorio, deposito. Ideale per studio medico, laboratorio tecnico assistenza, studio tecnico, legale, riparazioni o rappresentanza con deposito. Categoria C1, impianto riscaldamento / condizionamento per tutti i locali. Impianto allarme nuovo e attivo, con invio SMS in caso di allarme. Impianto elettrico a norma. Impianto elettrico separato per UPS. 2 bagni con antibagno. Impianto telefonico con centralino cablato per 2 linee esterne ed 8 interni. Cablato con 16 prese LAN a muro, tutte convogliate in vano tecnico per Router, Modem, Hub etc, adattissimo per Call Center! Vicinissimo metro Malatesta e fermate autobus. Garage privato ad ore vicinissimo. Locale disponibile da Settembre 2019, pulito, per uso immediato. Possibilita' finanziamento Microcredito a tasso agevolato 1%. 	Prenestino / Casilino 	1.700 	 12 ottobre, 08:45 	https://www.kijiji.it/annunci/affitto/roma-annunci-roma/negozio-169mq-per-laboratorio-ufficio-studio-a-roma/138596323	221	{1, 1154, 2562, 648, 266, 1418, 2188, 780, 2320, 1044, 2452, 1814, 23, 155, 2078, 670, 802, 934, 1704, 45, 1968, 177, 2100, 1462, 441, 2364, 1726, 1088, 1858, 67, 1220, 1990, 331, 1616, 1110, 2518, 89, 1242, 604, 221, 1374, 2012, 736, 353, 1506, 2144, 868, 1638, 1902, 1264, 2034, 758, 2298, 890}	54
1373	Studio accessoriato vicino metro A Furio Camillo 	Affitto studio a professionisti preferibilmente medico sanitari, Metro A fermata Furio Camillo 100 metri. Fermata bus 87 e 625 10 metri, fronte Villa Lazzaroni. Luminoso, finemente ristrutturato, pavimenti in parquet con aria condizionata autonoma doppio uso, luci a led, connessione internet wi-fi. E' previsto uso bagno, sala d'attesa, area ristoro, tutto con pavimento in parquet. E' possibile condividere lo studio con altri professionisti se gradito. Villa Lazzaroni ampia possibilità di parcheggio. 	Roma 	450 	 12 ottobre, 11:32 	https://www.kijiji.it/annunci/affitto/roma-annunci-roma/studio-accessoriato-vicino-metro-a-furio-camillo/144097122	1373	{0, 1153, 2561, 647, 1417, 2187, 779, 2319, 2451, 1043, 1813, 22, 154, 669, 2077, 801, 933, 1703, 44, 1967, 176, 2099, 1461, 440, 2363, 1725, 1087, 1857, 66, 1219, 1989, 330, 1615, 2517, 1109, 88, 1241, 2011, 603, 1373, 889, 2143, 352, 1505, 735, 867, 220, 1637, 1901, 1263, 2033, 757, 2297}	53
2489	Ufficio - Rif. Mazzola300 	Eur Tintoretto Via Valentino Mazzola proponiamo la locazione di ufficio di 300 mq ca. unico piano, in un palazzo direzionale con portineria e videosorveglianza. Possibilità di open space e ristrutturazione secondo le esigenze dell''eventuale conduttore.Vi è inoltre la possibilità di locare anche magazzini dai mq 50 ai mq 300 ad un canone di euro 90 mq/annuo e posti auto coperti prezzo richiesto euro 90 al mese cadauno. Disponibili anche altre metrature 	Roma 	Contatta l'utente 	 14 febbraio, 18:40 	https://www.kijiji.it/annunci/affitto/roma-annunci-roma/ufficio-rif-mazzola300/76193773	2489	{2322, 2323, 2324, 2325, 2326, 2330, 2461, 2463, 2336, 2465, 2337, 2338, 2464, 2472, 2219, 2221, 429, 2223, 2096, 2224, 2222, 2227, 2489, 2490, 2491, 60, 2492, 62, 63, 64, 65, 1987, 1988, 1992, 1993, 1994, 1995, 2530}	38
2337	Ufficio - Rif. Mazzola620 	Eur Tintoretto Via Valentino Mazzola proponiamo la locazione di ufficio di 620 mq ca. unico piano, in un palazzo direzionale con portineria e videosorveglianza. Possibilità di open space e ristrutturazione secondo le esigenze dell''eventuale conduttore.Vi è inoltre la possibilità di locare anche magazzini dai mq 50 ai mq 300 ad un canone di euro 90 mq/annuo e posti auto coperti prezzo richiesto euro 90 al mese cadauno. Disponibili anche altre metrature 	Roma 	Contatta l'utente 	 17 febbraio, 04:57 	https://www.kijiji.it/annunci/affitto/roma-annunci-roma/ufficio-rif-mazzola620/76302437	2337	{2322, 2323, 2325, 2326, 2330, 2461, 2463, 2464, 2337, 2338, 2465, 2472, 2219, 2221, 2222, 429, 2224, 2096, 2227, 2489, 2490, 2491, 2492, 60, 62, 64, 65, 1987, 1988, 1992, 1994, 1995}	32
2324	Ufficio - Rif. Mazzola750 	Eur Tintoretto Via Valentino Mazzola proponiamo la locazione di ufficio di 750 mq ca. unico piano, in un palazzo direzionale con portineria e videosorveglianza. Possibilità di open space e ristrutturazione secondo le esigenze dell''eventuale conduttore.Vi è inoltre la possibilità di locare anche magazzini dai mq 50 ai mq 300 ad un canone di euro 90 mq/annuo e posti auto coperti prezzo richiesto euro 90 al mese cadauno. Disponibili anche altre metrature 	Roma 	Contatta l'utente 	 1 marzo, 22:14 	https://www.kijiji.it/annunci/affitto/roma-annunci-roma/ufficio-rif-mazzola750/76883439	2324	{2322, 2323, 2324, 2326, 2330, 2461, 2463, 2464, 2336, 2338, 2465, 2472, 2219, 2221, 429, 2222, 2223, 2096, 2227, 2489, 2491, 60, 2492, 62, 63, 65, 1987, 1988, 1992, 1993, 1995, 2530}	32
2456	Ufficio - Rif. CH1d 	Prati Via di Cola di Rienzo all''interno di uno stabile di rappresentanza si affittano 3.500 mq di spazi ad uffici. Sono disponibili vari tagli da un minimo di 150 mq oppure, è possibile affittare più piani. Tel. 06.36006910 	Roma 	60.000 	 16 febbraio, 22:30 	https://www.kijiji.it/annunci/affitto/roma-annunci-roma/ufficio-rif-ch1d/76290012	2456	{2531, 2212, 298, 494, 1999, 52, 2229, 119, 2456}	9
355	Ufficio - Rif. CH1c 	Prati Via di Cola di Rienzo all''interno di uno stabile di rappresentanza si affittano uffici di 1300 mq. Sono disponibili tagli da 150 mq, 350 mq e 650 mq (intero piano) oppure, si possono affittare più piani per un totale di 3.200 mq. Tel. 06.36006910 	Roma 	24.500 	 12 febbraio, 22:22 	https://www.kijiji.it/annunci/affitto/roma-annunci-roma/ufficio-rif-ch1c/76088015	355	{355, 2211, 2533, 2506, 493, 1998, 51, 2230, 2455}	9
2369	Piazza Bologna 	Proniamo la locazione di un locale commerciale di mq 35 + mq 40 di sottonegozio in zona Piazza Bologna precisamente in Via Cremona. Richiesta fejdussione bancaria. La richiesta è di euro 1500,00. Cl. En. G. 	Roma 	1.500 	 17 febbraio, 02:01 	https://www.kijiji.it/annunci/affitto/roma-annunci-roma/piazza-bologna/76294980	2369	{2369, 259, 2180, 359, 455, 2601, 2294, 414}	8
2368	Negozio 1 locale - Rif. E74-01-07 	Proponiamo la locazione di un locale commerciale sito in Via E. Bombelli di mq 90 con tre vetrine su strada. Richiesta fejdussione bancaria. Cl. En. G. La richiesta mensile è di euro 1.600,00. 	Roma 	1.600 	 17 febbraio, 02:01 	https://www.kijiji.it/annunci/affitto/roma-annunci-roma/negozio-1-locale-rif-e74-01-07/76294983	2368	{2368, 258, 2179, 358, 454, 2600, 2293, 413}	8
2569	Locale commerciale + soppalco + magazzino 	In posizione di alta visibilità, proponiamo un locale commerciale angolare turro vetrinato di mq 145 al piano strada oltre una zona soppalcata di circa 20 mq e un locale sottostante uso magazzino di mq 250. Possibilità di installare la canna fumaria. la richiesta mensile è di euro 10.000,00. 	Roma 	10.000 	 14 febbraio, 01:55 	https://www.kijiji.it/annunci/affitto/roma-annunci-roma/locale-commerciale-soppalco-magazzino/76154688	2569	{260, 2372, 2569, 2125, 497, 466, 2035, 2266}	8
2351	Trieste 	TRIESTE corso PANORAMICISSIMO! fronte mausoleo di Santa Costanza con vista molto aperta e luminosissimo. Disponiamo di un appartamento di due camere, cucina e bagno. Si trova di fronte la metro ed è situato in un piano alto. Si affitta completamente VUOTO, con infissi doppi vetri, servizi recentemente ristrutturati. Contratti di lunga durata. euro 800,00. RIF. B-126. TEL. 06/50.43.347.www.ferrariemeriziola.it 	Roma 	800 	 17 febbraio, 02:08 	https://www.kijiji.it/annunci/affitto/roma-annunci-roma/trieste/76295148	2351	{2080, 2625, 193, 2307, 2351, 338, 2196, 2335}	8
2350	Ponte di nona 	PONTE DI NONA ATTICO in complesso residenziale con vista panoramica. L''appartamento è estremamente curato e rifinito composto da un ingresso che apre su un grande salone, cucina ampia a vista, due camere di cui una (quella matrimoniale) con vasca idromassaggio, ampio spogliatoio, servizio e un grande terrazzo di circa 50 mq. E'' incluso nel canone anche un box ampio. L''attico è dotato di listoni di parquet, porta blindata, doppi vetri, pannelli grigliati, termoautonomo..... Si affitta vuoto ma con cucina e bagno arredati. Solo buone referenze. Contratto CEDOLARE SECCA. euro 800,00. RIF. B-124. TEL. 06/50.43.347. www.ferrariemeriziola.it 	Roma 	800 	 17 febbraio, 02:08 	https://www.kijiji.it/annunci/affitto/roma-annunci-roma/ponte-di-nona/76295149	2350	{2624, 2306, 2499, 2350, 113, 337, 2195, 2079}	8
2348	Talenti 	TALENTI adiacente Viale Fucini disponiamo di un bellissimo appartamento di grande metratura composto da un ingresso, salone, due camere, cameretta, cucina con tinello, doppi servizi, due ripostigli, un armadio a muro, balcone e un terrazzo grande che gira tutt''intorno all''appartamento. La casa si trova in ottimo stato, ritinteggiata e si affitta VUOTA con contratti di lunga durata. euro 1.000,00. RIF. B-151. TEL. 06/50.43.347. www.ferariemeriziola.it 	Roma 	1.000 	 17 febbraio, 02:09 	https://www.kijiji.it/annunci/affitto/roma-annunci-roma/talenti/76295156	2348	{390, 2250, 2348, 141, 370, 2547, 2101, 219}	8
2570	Locale centro storico ad. Parlamento 	In Via del Pozzo, di fianco al palazzo di Zara e con affaccio su Largo Chigi e Via del Corso, proponiamo un negozio con tre ingressi di mq 70 circa al piano strada e mq 70 circa al piano ammezzato. No canna fumaria. Il locale è in corso di ristrutturazione ed è disponible a luglio 2015. La richiesta è di euro 9.000,00 mensili. 	Roma 	9.000 	 14 febbraio, 01:55 	https://www.kijiji.it/annunci/affitto/roma-annunci-roma/locale-centro-storico-ad-parlamento/76154687	2570	{261, 2373, 2570, 2126, 178, 2036, 2484, 2267}	8
2274	Ufficio centro 	In palazzo d''epoca con servizio di portineria, di frontte al Ministero dell''Economia, proponiamo un piccolo ufficio di mq 32 posto al 6° piano. L''immobile si compone di 2 stanze e bagno c''è la predisposizione all''angolo cottura. La richiesta è di euro 1.000,00. 	Roma 	1.000 	 2 marzo, 02:05 	https://www.kijiji.it/annunci/affitto/roma-annunci-roma/ufficio-centro/76886904	2274	{2274, 2597, 105, 2382, 245, 182, 2174, 2046}	8
2282	Locale centro storico Pantheon 	In posizione di elevaro passaggio pedonale in zoma Pantheon proponiamo in locazione un negozio di mq 130 tutto al piano strada, di cui mq 80 di C/1 e mq 50 di C/2, con un''ampia porta di ingresso e 4 vetrine murali. Il locale èm dotato di canna fumaria considerata la posizione il negozio si presta per qualsiasi tipo di attività. La richiesta è di euro 12.000,00 + buonauscita. 	Roma 	12.000 	 1 marzo, 23:50 	https://www.kijiji.it/annunci/affitto/roma-annunci-roma/locale-centro-storico-pantheon/76884830	2282	{2282, 2414, 241, 311, 2585, 476, 94, 415}	8
2287	Attico ad. Parlamento 	In palazzo d''epoca con servizio di portineria, proponiamo un attico di mq 70 circa posto al 5° piano e composto da ampio soggiorno con a/c, camera, bagno e ampio ripostiglio. Completa la proprietà un terrazino con affaccio su cortile interno. Aria condizionata cado/freddo centralizzata. La richiesta è di euro 1890,00. 	Roma 	1.890 	 1 marzo, 23:50 	https://www.kijiji.it/annunci/affitto/roma-annunci-roma/attico-ad-parlamento/76884825	2287	{99, 2058, 459, 2287, 2419, 2167, 316, 2590}	8
2288	Ufficio - Rif. E74-04-37 	In prestigioso palazo d''epoca con servizio di portineria e di videosorveglianza, proponiamo un ufficio posto al 3° piano di mq 170 con affaccio su Piazza di Spagna. L''ufficio si compone di ampia reception, sala riunioni,5 stanze e doppi servizi. La richiesta mensile è di euro 7.000,00 mensili. Cl. En. A 	Roma 	7.000 	 1 marzo, 23:50 	https://www.kijiji.it/annunci/affitto/roma-annunci-roma/ufficio-rif-e74-04-37/76884824	2288	{100, 2059, 460, 2288, 2420, 2168, 317, 2591}	8
2289	Ufficio Piazza di Spagna 	In prestigioso palazo d''epoca con servizio di portineria e di videosorveglianza, proponiamo un ufficio posto al 2° piano di mq 120 con affaccio su Piazza di Spagna. L''ufficio si compone di doppio ingresso, ampia sala riunioni, 4 stanze e servizi. La richiesta mensile è di euro 5.000,00 mensili. Cl. En. G 	Roma 	5.000 	 1 marzo, 23:50 	https://www.kijiji.it/annunci/affitto/roma-annunci-roma/ufficio-piazza-di-spagna/76884822	2289	{2592, 101, 2060, 461, 2289, 2421, 2169, 318}	8
156	Infernetto 	INFERNETTO Giordano in complesso residenziale villino a schiera su 3 livelli in perfetto stato completamente arredato composto da saloncino all''americana 2 camere cucinotto, doppi servizi, ampia sala hobby, terrazzo, piccolo giardino e box auto. Termoautonomo. Euro 1.100,00 Rif. B-134 www.ferrariemeriziola.it Tel. 06/5043347 SI AFFITTA ESCLUSIVAMENTE AD INQUILINI REFERENZIATI ED IN POSSESSEO DI UN REDDITO DOCUMENTABILE 	Roma 	1.100 	 13 febbraio, 07:52 	https://www.kijiji.it/annunci/affitto/roma-annunci-roma/infernetto/76113224	156	{448, 2528, 2017, 2112, 2437, 364, 2610, 156}	8
2571	,agazzino centro storico 	Su Largo Chigi al piano ammezzato di un palazzo d''epoca con ascensore, proponiamo due locali uso magazzinmo di mq 30 cadauno. La richiesta è di euro 850,00 mensili cadauno. 	Roma 	850 	 14 febbraio, 01:55 	https://www.kijiji.it/annunci/affitto/roma-annunci-roma/agazzino-centro-storico/76154684	2571	{2374, 230, 2571, 2127, 179, 2037, 2485, 2268}	8
2572	Negozio - Rif. E74-04-15 	In pieno centro storico tra Piazza San Lorenzo in Lucina e Piazza Fontanella Borghese, proponiamo un locale commerciale di complessivi 270 mq su tre livelli, di cui al piano strada mq 80 con tre porte d''ingresso, al primo piano mq 120 tutto finestrato, entrambi i livelli di categaoria catastale C/1 e un piano interrato di mq 70 uso magazzino e servizi. Il locale è munito di canna fumaria. La richiesta mensile è di euro 15.000,00. 	Roma 	15.000 	 14 febbraio, 01:55 	https://www.kijiji.it/annunci/affitto/roma-annunci-roma/negozio-rif-e74-04-15/76154683	2572	{2375, 231, 2572, 2128, 498, 467, 2038, 2269}	8
157	San paolo marconi 	SAN PAOLO MARCONI Via Novacella In palazzina in cortina in zona residenziale e silenziosae ben servitaproponiamo l ''Affitto di un immobile posto al primo piano alto luminosoVuoto e così composto: Soggiorno all'' americana, 2 Camere, Cucinino, Armadio a muro, Ripostiglio, Servizio e 2 Balconi vivibili. L'' Immobileè dotato di: Riscaldamento autonomo, Aria condizionata, Porta blindata, Parquet,Infissi in alluminio con doppi vetri, Servizio di portineria. Ottimo anche ad uso ufficio. Euro 900 Rif. Z-481 SI AFFITTA ESCLUSIVAMENTE AD INQUILINI REFERENZIATI ED IN POSSESSO DI UN REDDITO DOCUMENTATO. Tel. 06.53.55.67 www.ferrariemeriziola.it 	Roma 	900 	 13 febbraio, 07:52 	https://www.kijiji.it/annunci/affitto/roma-annunci-roma/san-paolo-marconi/76113223	157	{2529, 2018, 2113, 2438, 365, 2611, 157, 2238}	8
2425	Luminosa soluzione abitativa al Teatro della Pace 	Con affacci sul Teatro della Pace e degli scorci su Piazza Navona, si propone in locazione luminoso appartamento di 130 mq, al 4° piano con ascensore. La proprietà si compone di: ampio ingresso, salone con camino ed un grazioso balconcino, cucina abitabile e due camere da letto, ognuna con con bagno en suite. I pavimenti sono in parquet, il riscaldamento è autonomo. All''interno ci sono numerosi armadi a muro, la cucina è arredata e fornita anche di elettrodomestici. Il tutto è completato da una cantina. Questa soluzione abitativa ha il pregio di avere spazi interni gestiti in modo funzionale ed è l''ideale per chi vuole vivere in una delle location più affascinanti del Centro Storico. 	Roma 	2.900 	 16 febbraio, 23:53 	https://www.kijiji.it/annunci/affitto/roma-annunci-roma/luminosa-soluzione-abitativa-al-teatro-della-pace/76291822	2425	{1985, 130, 453, 2598, 2123, 2065, 2513, 2425}	8
2460	Ufficio - rif. pascarella 	Trastevere Via Pascarella in centro direzionale proponiamo la locazione di un ufficio posto al piano primo e piano secondo, con uno spazio archivi al piano seminterrato, per un totale di 1274 mq. Tel 06.36006910 	Roma 	25.500 	 16 febbraio, 22:30 	https://www.kijiji.it/annunci/affitto/roma-annunci-roma/ufficio-rif-pascarella/76290006	2460	{2467, 2216, 302, 432, 2003, 56, 121, 2460}	8
2466	Negozio - Rif. Valadier 	Prati Via Valadier locale commerciale 210 mq tutto piano su strada con 3 vetrine. Posizione strategica in quanto a due passi da Via Cola di Rienzo e Piazza Cavour. Zona con alto passaggio pedonale e con palazzi ad uffici. 	Roma 	10.500 	 16 febbraio, 08:21 	https://www.kijiji.it/annunci/affitto/roma-annunci-roma/negozio-rif-valadier/76259311	2466	{2466, 2215, 301, 431, 2002, 55, 120, 2459}	8
501	Centro storico appartamento 	In Via XX Settembre in stabile d''epoca con servizio di portineria, appartamento posto al quinto piano di mq 150, composto da sei camere, cucina abitabile, doppi servizi e ripostiglio. L''immobile è da ristrutturare a cura e spese della proprietà con consegna 60/90 giorni. Riscaldamento centralizzato. la richiesta è di euro 3.670,00 mensili. 	Roma 	3.670 	 11 febbraio, 22:11 	https://www.kijiji.it/annunci/affitto/roma-annunci-roma/centro-storico-appartamento/76031994	501	{2272, 2378, 234, 2575, 2131, 501, 470, 2041}	8
500	Negozio - Rif. E74-04-17 	In posizione di alta visibilità, proponiamo un locale commerciale tutto vetrinato, composto da piano terra di mq 140, piano soppalcato (altezza mq 2,4) di mq 125 e piano interrato di mq 300. La richiesta mensile è di euro 10.650,00. 	Roma 	10.650 	 11 febbraio, 22:11 	https://www.kijiji.it/annunci/affitto/roma-annunci-roma/negozio-rif-e74-04-17/76031995	500	{233, 2377, 2574, 2130, 500, 469, 2040, 2271}	8
499	Negozio - Rif. E74-04-16 	Nel cuore del quartiere Monti e precisamente in Via Urbana, proponiamo un locale commerciale di mq 610 tutto al piano terra, adatto per attività di supermercato. La richiesta è di euro 12.200,00 mensili. 	Roma 	12.200 	 11 febbraio, 22:11 	https://www.kijiji.it/annunci/affitto/roma-annunci-roma/negozio-rif-e74-04-16/76031997	499	{2376, 232, 2573, 2129, 499, 468, 2039, 2270}	8
464	Ufficio Piazza Fiume 	Proponiamo la locazione di un ufficio sito in via Salaria adiacente Piazza Fiume, l''immobile di mq 170 è composto da un''ampia sala riunioni, quattro stanze, archivio e servizio, molto luminoso, affacci esterni. La richiesta è di euro 3000/mese. Cl. En. G 	Roma 	3.000 	 12 febbraio, 03:43 	https://www.kijiji.it/annunci/affitto/roma-annunci-roma/ufficio-piazza-fiume/76040722	464	{2242, 1991, 424, 464, 2582, 250, 2139, 188}	8
2457	Eur Acqua Acetosa Ostiense 	Afitto appartamento Eur Papillo Acqua Acetosa Ostiense VIa Vigolo proponiamo in affitto in palazzina in cortina del 2003 primo piano ottimo stato composto da salone a vista camera da letto cucina abitabile arredata bagno con vasca 3 balconi di cui 1 vivibile con barbeque due armadi a muro, completa la proprietà un box di 16 mq. ca. euro 900,00 immobili & imprese srl tel. 06/5923798 	Roma 	900 	 16 febbraio, 22:30 	https://www.kijiji.it/annunci/affitto/roma-annunci-roma/eur-acqua-acetosa-ostiense/76290010	2457	{2532, 2213, 425, 299, 2000, 2228, 53, 2457}	8
2381	Ufficio centro Ministero dell'Economia 	In palazzo d''epoca con servizio di portineria, di fronte al Ministero dell''Economia, proponiamo un ufficio posto al 3° piano di mq 284 con doppio ingresso. L''immobile occupa l''intero 3° piano. La richiesta è di euro 7.000,00 mensili. 	Roma 	7.000 	 17 febbraio, 02:00 	https://www.kijiji.it/annunci/affitto/roma-annunci-roma/ufficio-centro-ministero-dell-economia/76294946	2381	{2273, 2596, 104, 2381, 2045, 244, 181, 2173}	8
2384	Ufficio Corso Trieste 	In uno stabile con servizio di portineria, proponiamo un ufficio di mq 312 posto al 7° ed 8° piano. La richiesta è di euro 6.000,00. Cl. En. G. 	Roma 	6.000 	 17 febbraio, 01:59 	https://www.kijiji.it/annunci/affitto/roma-annunci-roma/ufficio-corso-trieste/76294934	2384	{2048, 420, 107, 2384, 2578, 2135, 247, 184}	8
143	Aurelia antica 	AURELIA ANTICA in una bella strada accanto via Aurelia Antica disponiamo di un bellissimo appartamento in eccellenti condizioni composto da un grande salone con una spaziosa cucina a vista, due camere da letto, doppi servizi e un terrazzo ampio. . Lo stabile in cui si trova è una piccola palazzina residenziale in cortina. L''immobile ha uno splendido affaccio sul verde, risulta essere molto silenzioso, è dotato di parquet, impianto di allarme, doppi vetri, marmi lussuosi nel bagno, porta blindata, il riscaldamento è autonomo. SI AFFITTA A PERSONE REFERENZIATE. euro 1.150,00. Su richiesta possibilità di avere un box ampio di circa 22 mq ad euro 50,00. RIF. B-80. TEL. 06/50.43.347. www.ferrariemeriziola.it 	Roma 	1.150 	 13 febbraio, 07:55 	https://www.kijiji.it/annunci/affitto/roma-annunci-roma/aurelia-antica/76113394	143	{2519, 2252, 2445, 143, 2549, 2103, 189}	7
2234	Colombo Mura Aureliane 	Uffcio in affitto Via Cristoforo Colombo vicinanze mure aureliane in edificio direzionale con servizio di portineria e videosorveglianza proponiamo in affitto luminosissimo con pareti a vetri, ufficio moderno ristrutturato e cablato di mq 355 posto al piano 6 composto da recepction e sala d''attesa 11 stanze sala riunioni tripli servizi con possibilità open space. Ubicato nelle vicinanze della metro B Garbatella e della Stazione Ostiense. Canone mensile euro 3300. Possibilità di posti auto coperti euro 150 al mese caduno. Per informazioni rivolgersi ad Immobil & Imprese srl tel. 06/5923798 	Roma 	7.450 	 2 marzo, 06:11 	https://www.kijiji.it/annunci/affitto/roma-annunci-roma/colombo-mura-aureliane/76897506	2234	{128, 2083, 535, 202, 2477, 439, 2234}	7
403	Ufficio - Rif. CH1b 	Prati Via di Cola di Rienzo all''interno di uno stabile di rappresentanza si affittano uffici di 150 mq. Sono disponibili anche tagli da 350 mq e 650 mq (intero piano) oppure, si possono affittare più piani per un totale di 3.200 mq. Tel. 06.36006910 	Roma 	3.000 	 12 febbraio, 10:59 	https://www.kijiji.it/annunci/affitto/roma-annunci-roma/ufficio-rif-ch1b/76062729	403	{354, 2505, 492, 1997, 403, 2454, 381}	7
391	Centocelle 	CASILINA Centocelle esattamente in via delle Acacie disponiamo di un bel bicamere così composto: ingresso ampio, un comodo soggiorno, una camera matrimoniale, cucina abitabile, bagno e un piccolo balcone. Le stanze sono tutte quadrate, la casa è luminosa ed espone su un ampio esterno. La palazzina è piccola e si presenta in buone condizioni. Verrà consegnata VUOTA e completamente ritinteggiata.SI AFFITTA A PERSONE REFERENZIATE. RIF. B-92. euro 680,00. tel. 06/50.43.347. www.ferrariemeriziola.it 	Roma 	680 	 12 febbraio, 11:41 	https://www.kijiji.it/annunci/affitto/roma-annunci-roma/centocelle/76064787	391	{391, 2251, 2349, 142, 371, 2548, 2102}	7
