	Title	Short Description	Location	Price (Euro)	Timestamp	Url Adv	doc_id	similar_docs	num_similar_docs
2340	Eur Mostacciano 	Affitto negozio Roma Sud zona Eur Mostacciano offriamo in locazione locale commerciale libero, ottimo visibilità, coposto da 4 ampie vetrine per una suerficie di 180 mq totalmente allestito per no sportello bancario. il canone di locazione mensile è di euro 5.500,00. Per informazioni rivolgersi ad Immobii & Imprese srl tel. 06/5923798 	Roma 	5.500 	 17 febbraio, 04:56 	https://www.kijiji.it/annunci/affitto/roma-annunci-roma/eur-mostacciano/76302379	2340	{2340, 487, 2538, 2091, 2098, 2328, 2493}	7
2339	Ufficio 13 locali - Rif. Mazzola420 	Eur Tintoretto Via Valentino Mazzola proponiamo la locazione di ufficio di 420 mq ca. unico piano, in un palazzo direzionale con portineria e videosorveglianza. Ristrutturato con ottime rifiniture, cablato.Luminosissimo con vista panoramica su tutta Roma. Vi è inoltre la possibilità di locare anche magazzini dai mq 50 ai mq 300 ad un canone di euro 90 mq/annuo e posti auto coperti prezzo richiesto euro 90 al mese cadauno. Disponibili anche altre metrature 	Roma 	Contatta l'utente 	 17 febbraio, 04:56 	https://www.kijiji.it/annunci/affitto/roma-annunci-roma/ufficio-13-locali-rif-mazzola420/76302382	2339	{2339, 486, 2535, 2537, 2090, 2097, 2327}	7
2005	Ufficio - Rif. Solferino_123 	Centro Storico Piazza Indipendenza in centro direzionale ufficio posto al 8° piano di 123 mq euro 3.000/mese. Possibilità di mq 289 al piano 7° euro 7.200/mese Tel. 06.36006910 	Roma 	3.000 	 5 marzo, 04:35 	https://www.kijiji.it/annunci/affitto/roma-annunci-roma/ufficio-rif-solferino-123/77032130	2005	{2469, 2218, 304, 434, 2005, 58, 123}	7
102	Centro ad. Parlamento 	In palazzo d''epoca con servizio di portineria, proponiamo un uffic posto al piano ammezzato di mq 65, composto da 2 camere e 2 bagni. Ristrutturato. Aria condizionata caldo/freddo centralizzata. La richiesta è di euro 1.840,00 mensili. Cl. En. A 	Roma 	1.840 	 13 febbraio, 13:02 	https://www.kijiji.it/annunci/affitto/roma-annunci-roma/centro-ad-parlamento/76131234	102	{2593, 102, 2061, 2290, 2422, 2170, 319}	7
2049	Ufficio Corso Trieste 	In uno stabile con servizio di portineria, proponiamo un ufficio posto al 2° piano di mq 225 oltre soffitta al piano sottotetto. La richiesta è di euro 4.300,00. Cl. En. G. 	Roma 	4.300 	 5 marzo, 02:12 	https://www.kijiji.it/annunci/affitto/roma-annunci-roma/ufficio-corso-trieste/77025260	2049	{2049, 421, 108, 2579, 248, 185, 2136}	7
2050	Uffico Corso Trieste 	In stabile con servizio di portineria, proponiamo un ufficio angolare di mq 185. La richiesta è di euro 3500,00. Cl. En. G. 	Roma 	3.500 	 5 marzo, 02:11 	https://www.kijiji.it/annunci/affitto/roma-annunci-roma/uffico-corso-trieste/77025258	2050	{2137, 2050, 422, 109, 2580, 249, 186}	7
2172	Prestigioso ufficio 	In stabile d''epoca con servizio di portineria, proponiamo un prestigioso ufficio di mq 600 con 4 ingressi. Aria condizionata caldo/freddo centralizzata. La richiesta è di euro 19.000,00 mensili. 	Roma 	19.000 	 2 marzo, 23:53 	https://www.kijiji.it/annunci/affitto/roma-annunci-roma/prestigioso-ufficio/76928011	2172	{2595, 103, 2044, 2380, 2292, 180, 2172}	7
2334	Eur Montagnola 	Affitto locale commerciale Eur Laurentina Montagnola Piazzale Ardigò proponiamo in affitto negozio libero di 280 mq. buono stato interno con 5 grandi vetrine ottima visibilità euro 8.000,00 immobili & imprese srl tel. 06/5923798 	Roma 	8.000 	 20 febbraio, 18:06 	https://www.kijiji.it/annunci/affitto/roma-annunci-roma/eur-montagnola/76482507	2334	{2214, 426, 300, 2001, 54, 2458, 2334}	7
386	Monteverde gianicolense 	MONTEVERDE GIANICOLENSE Ad. VIA OZANAM Proponiamo l'' Affitto di un locale commerciale di circa 20 mq a livello strada con serranda avvolgibile elettrica. L'' Immobile è composto da un unico ambiente a vista, un servizio ed un piccolo soppalco. E'' stato completamente ristrutturato ed è in ottime condizioni, dotato anche di aria condizionata. Adatto per uso commerciale o uso ufficio. E 450 Rif.Z-390 SI AFFITTA ESCLUSIVAMENTE AD INQUILINI REFERENZIATI ED IN POSSESSO DI UN REDDITO DOCUMENTATO. Tel.06.53.55.67 www.ferrariemeriziola.it 	Roma 	450 	 12 febbraio, 11:45 	https://www.kijiji.it/annunci/affitto/roma-annunci-roma/monteverde-gianicolense/76064965	386	{289, 386, 2344, 137, 2317, 2010, 2206}	7
303	Ufficio - Rif. Solferino_289 	Centro Storico Piazza Indipendenza in centro direzionale ufficio posto al 7° piano di 289 mq euro 7.200/mese. Possibilità mq 123 al piano 8° euro 3.000/mese Tel. 06.36006910 	Roma 	7.200 	 12 febbraio, 23:47 	https://www.kijiji.it/annunci/affitto/roma-annunci-roma/ufficio-rif-solferino-289/76090986	303	{2468, 2217, 303, 433, 2004, 57, 122}	7
2006	Ufficio - Rif. L.Caro 	Prati Via Lucrezio Caro in centro direzionale proponiamo in locazione uffici posti al piano 2° - 3° - 5° rispettivamente di: 2° piano 221 mq euro 5000/mese 3° piano 223 mq e 278 mq euro 5.100/mese - euro 6.400/mese 5° piano 203 mq euro 4.600/mese Il canone richiesto è pari a euro 276/mq 	Roma 	5.000 	 5 marzo, 04:35 	https://www.kijiji.it/annunci/affitto/roma-annunci-roma/ufficio-rif-l-caro/77032121	2006	{2470, 2475, 305, 435, 2006, 59, 124}	7
2057	Attico - Rif. E74-04-05 	In un elegante palazzo d''epoca con servizio di portineria e di videosorveglianza proponiamo uno splendido attico con affaccio su Piazza di Spagna. L''unità immobiliare ha una superficie di mq 220 e un terrazzo di mq 125 su Piazza di Spagna e altro terrazzino su corte interna di mq 30. L''appartamento prende tutto l''intero piano attico ed è da ristrutturare a spese della proprietà e si compone di un ampio ingresso - pranzo, una cucina padronale, tre ampie camere matrimoniali tutte con bagno interno oltre un bagno per gli ospiti. La richiesta è di euro 12.000,00 mensili. Cl. En. G. 	Roma 	12.000 	 5 marzo, 00:04 	https://www.kijiji.it/annunci/affitto/roma-annunci-roma/attico-rif-e74-04-05/77020818	2057	{98, 2057, 458, 2286, 2418, 315, 2589}	7
2359	Infernetto 	INFERNETTO dependance di villa completamente indipendente ed arredata composta da soggiorno all''americana con angolo cottura camera servizio ampio patio e giardinetto termoautonoma Euro 550,00 Rif. B-65 - Tel.06/5043347 www.ferrariemeriziola.it SI AFFITTA ESCLUSIVAMENTE AD INQUILINI REFERENZIATI ED IN POSSESSO DI UN REDDITO DOCUMENTABILE 	Roma 	550 	 17 febbraio, 02:07 	https://www.kijiji.it/annunci/affitto/roma-annunci-roma/infernetto/76295129	2359	{2315, 78, 2512, 2013, 2359, 2204, 2557}	7
2343	Talenti 	TALENTI su strada commerciale con tanti negozi, disponiamo di un locale con una grande e comoda vetrina di entrata ma soprattutto una ottima visibilità. Il locale é di Cat. C/1 ma dispone anche di un sottolocale di cat. C/2, della stessa metratura e dotato di servizio. Il negozio è da risistemare ma la vetrata di entrata è in ottimo stato. Dispone di una serranda elettrica. Si affitta uso commerciale 6 + 6, con fidejussione bancaria. euro 1.300,00. RIF. B-35. tel. 06/50.43.347. www.ferrariemeriziola.it 	Roma 	1.300 	 17 febbraio, 02:10 	https://www.kijiji.it/annunci/affitto/roma-annunci-roma/talenti/76295194	2343	{2081, 134, 2502, 2343, 2249, 427, 2546}	7
106	Ufficio centro ad. Ministero Economia 	In palazzo d''epoca con servizio di portineria, di fronte al Ministero dell''Economia, proponiamo un ufficio posto al 2° piano di mq 152. La richiesta è di euro 3.900,00 mensili. 	Roma 	3.900 	 13 febbraio, 13:01 	https://www.kijiji.it/annunci/affitto/roma-annunci-roma/ufficio-centro-ad-ministero-economia/76131178	106	{106, 2383, 2577, 246, 183, 2047, 2175}	7
2020	Appartamento 3 locali - Rif. B-135 	OSTIA adiacente lungomare ed Appagliatore appartamento completamente ristrutturato ed arredato composto da ingresso soggiorno, 2 camere, cucina abitabile, doppi servizi, balcone e terrazzo Euro.800,00 Rif. B-135 Tel. 06/5043347 www.ferrariemeriziola.it SI AFFITTA ESCLUSIVAMENTE AD INQUILINI REFERENZIATI ED IN POSSESSO DI UN REDDITO DOCUMENTABILE 	Roma 	800 	 5 marzo, 02:22 	https://www.kijiji.it/annunci/affitto/roma-annunci-roma/appartamento-3-locali-rif-b-135/77025621	2020	{449, 2115, 2020, 2440, 2613, 2486, 159}	7
2567	Ufficio - Rif. E74-02-27 	Vi proponiamo nel cuore del quartieri Coppedè, in un palazzo signorile, la locazione di un ufficio di alta rappresentanza. L''immobile è sito al terzo piano ed ha una superficie coperta di 280 mq con doppio ingresso. Contratto 6+6. Cl. En. G 	Roma 	9.000 	 14 febbraio, 01:56 	https://www.kijiji.it/annunci/affitto/roma-annunci-roma/ufficio-rif-e74-02-27/76154701	2567	{2370, 2245, 2181, 2567, 456, 496, 2524}	7
146	Appio latino 	APPIO LATINO ad.metro Ponte Lungo precisamente Via Michele Amari proponiamo la locazione di un appartamento recentemente ristrutturato composto da ingresso soggiorno con angolo cottura una camera da letto con ampia cabina armadio e bagno con doccia. Termoautonomo referenziati con busta paga dimostrabile VUOTO NO STUDENTI NO ANIMALI euro 750,00 rif.G-200 Tel.06/700.88.92 www.ferrariemeriziola.it 	Roma 	750 	 13 febbraio, 07:55 	https://www.kijiji.it/annunci/affitto/roma-annunci-roma/appio-latino/76113383	146	{2520, 2446, 146, 532, 2104, 442, 2619}	7
2355	Portuense villa bonelli 	PORTUENSE VILLA BONELLI proponiamo immobile A/10 recentemente ristrutturato, posto al piano terra di palazzina di quattro, con doppia esposizione, ingresso indipendente con ampio spazio carrabile di 43 mq, composto da quattro camere bagno e ripostiglio. euro1200 rif. Z-472 tel. 06.535567 www.ferrariemeriziola.it 	Roma 	1.200 	 17 febbraio, 02:07 	https://www.kijiji.it/annunci/affitto/roma-annunci-roma/portuense-villa-bonelli/76295135	2355	{2311, 73, 2521, 2355, 151, 2200, 2553}	7
2233	Immobile commerciale indipendente 	Affittoimmobile commerciale Roma Nord loaclità La Storta in Via Lerici immobile cielo terra con destinazione commerciale in fase di ultimazione di forma rettangolare di circa 535 mq con altezza minima interna 3,10 m. ed altezza massima 4,70 m., piano interrato di circa 1.200 mq. di cui circa 940 mq ad autorimessa e circa 260 mq a magazzino, spazio esterno di circa 2.000 mq. a verde e pargheggio oltre ad un atettoia. Ulteiore superficie a destinazione commerciale di circa 160 mq con parcheggio esterno di circa 200 mq. euro 15.000,00 immobli & imprese srl tel. 06/5923798 	Roma 	15.000 	 2 marzo, 06:11 	https://www.kijiji.it/annunci/affitto/roma-annunci-roma/immobile-commerciale-indipendente/76897513	2233	{2082, 201, 2476, 438, 534, 2233, 127}	7
2510	Delizioso attico con affacci sul Quirinale 	Piazza Scanderbeg, con affacci sul Quirinale, in posizione strategica rispetto alle zone più belle del Centro Storico, delizioso attico di 65 mq, al 5° piano con ascensore. La proprietà, che viene offerta in locazione completa di arredi, si compone di: ingresso sul luminoso salone con camino ed accesso diretto alla terrazza, cucina, camera da letto, bagno. Con spazi suddivisi in modo funzionale, questa soluzione abitativa ha il grandissimo pregio di essere costantemente inondata di luce e sempre immersa in un piacevolissimo silenzio, pur essendo collegata con le più importanti zone del Centro Storico. Il fascino della location la rende unica nel suo genere. Assolutamente da non perdere per chi vuole vivere il Centro Storico nella sua dimensione più tranquilla. 	Roma 	1.900 	 14 febbraio, 09:00 	https://www.kijiji.it/annunci/affitto/roma-annunci-roma/delizioso-attico-con-affacci-sul-quirinale/76172028	2510	{131, 452, 2246, 2541, 2510, 2064, 2424}	7
2016	Eur 	EUR adiacente metro Laurentina appartamento ristrutturato completamente arredato composto da ingresso, salone, 2 camere, cameretta, cucina abitabile, doppi servizi, 2 balconi e cantina. Euro 1.000,oo Rif. B.123 Tel. 06/5043347 www.ferrariemeriziola.it Tel.06/5043347 SI AFFITTA ESCLUSIVAMENTE AD INQUILINI REFERENZIATI ED IN POSSESSO DI UN REDDITO DOCUMENTABILE 	Roma 	1.000 	 5 marzo, 02:23 	https://www.kijiji.it/annunci/affitto/roma-annunci-roma/eur/77025652	2016	{2016, 2436, 2527, 363, 2543, 2111, 447}	7
2043	Appartamento - Rif. E74-04-22 	In stabile con servizio di portineria, proponiamo un appartamento di mq 228 composto da salone triplo, tre camere da letto, cameretta, cucina - tinello, tre bagni, posto al quarto piano. Riscaldamento centralizzato. La richiesta di euro 2.950,00 mensili. 	Roma 	2.950 	 5 marzo, 02:12 	https://www.kijiji.it/annunci/affitto/roma-annunci-roma/appartamento-rif-e74-04-22/77025278	2043	{503, 2277, 2409, 236, 2133, 471, 2043}	7
392	Casetta mattei 	CASETTA MATTEI -Via Caldora- In complesso di quattro palazzine nel verde, Adiacente Centro commerciale e Supermercati, nelle vicinanze di scuole e mezzi pubblici, Proponiamo l'' Affitto di un immobile Posto al primo piano Arredato completamente e cosi'' composto: Grande Salone, 3 Camere da letto, Cucina abitabile per 4 persone, Doppi Servizi e Balcone. Completa la proprietà un Posto Auto scoperto. Euro 1150 Rif. Z-456 SI AFFITTA ESCLUSIVAMENTE AD INQUILINI REFERENZIATI ED IN POSSESSO DI UN REDDDITO DOCUMENTATO. Tel. 06.53.55.67 www.ferrariemerizola.it 	Roma 	1.150 	 12 febbraio, 11:41 	https://www.kijiji.it/annunci/affitto/roma-annunci-roma/casetta-mattei/76064777	392	{2304, 392, 2107, 334, 2449, 443, 2621}	7
2284	Locale Piazza San Silvestro 	Su Piazza di San Claudio, crocevia tra Piazza San Silvestro, Largo Chigi, Via del Tritone e Via del Corso proponiamo una ottima opportuniità di un locale commerciale di mq 45 con un''ampia porta di ingresso e mq 20 al piano ammezzato. La posizione è di alta visibilità. No attività di somministrazione. Il locale è disponibile da luglio 2015. La richiesta è di euro 5.800,00. 	Roma 	5.800 	 1 marzo, 23:50 	https://www.kijiji.it/annunci/affitto/roma-annunci-roma/locale-piazza-san-silvestro/76884828	2284	{96, 417, 2284, 2416, 313, 2587, 478}	7
2283	Locale centro Piazza di Spagna 	Nelle immediate vicinanze di Piazza di Spagna e precisamente in Via Vittoria, proponiamo una interessante opportunità di un negozio di mq 90 al piano strada con una chiostrina interna di pertinenza e un sottonegozio uso magazzini e servizi di mq 50. Il locale è dotato di canna fumaria da ripristinare a norma. La richiesta è di euro 9.300,00,+ buonauscita. 	Roma 	9.300 	 1 marzo, 23:50 	https://www.kijiji.it/annunci/affitto/roma-annunci-roma/locale-centro-piazza-di-spagna/76884829	2283	{416, 2283, 2415, 312, 2586, 477, 95}	7
2278	Attico - Rif. E74-04-23 	Attico al quinto piano di mq 70 e terrazzo a livello di mq 90, composta da cucinotto soggiorno, camera, cameretta e doppi servizi. Ristrutturato. Aria condizionata calda/fredda centralizzata. Stabile d''epoca con servizio di portineria. La richiesta mensile è di euro 3.000,00 mensili. 	Roma 	3.000 	 1 marzo, 23:50 	https://www.kijiji.it/annunci/affitto/roma-annunci-roma/attico-rif-e74-04-23/76884835	2278	{2278, 472, 2410, 237, 2134, 504, 90}	7
321	Eleganza e charme nel centro di Roma 	Elegante appartamento al sesto ed ultimo piano mansardato di un importante palazzo del 1500, nei pressi di Piazza Venezia, dotato di ascensore e di servizio di portineria. La proprietà si compone di ingresso, ampio salone con camino funzionante a gas, stanza da pranzo che accede ad un terrazzo di circa 10 mq con incredibile vista sui tetti di Roma. E'' inoltre dotata di comodo bagno per ospiti con vasca da bagno, di una confortevole cucina arredata e di un grande soggiorno con cucinotto a vista. La zona notte include due camera da letto matrimoniali con armadi a muro e ampi bagni en suite uno con doccia e l''altro con vasca, terza camera da letto con due letti singoli. L''appartamento è arredato e luminoso ed è fornito di aria condizionata in tutte le stanze, riscaldamento autonomo, doppi vetri alle finestre e incantevole vista su entrambi lati dell''immobile. La disponibilità è immediata e si richiedono referenze. No attività ricettive. 	Roma 	3.500 	 12 febbraio, 23:03 	https://www.kijiji.it/annunci/affitto/roma-annunci-roma/eleganza-e-charme-nel-centro-di-roma/76089457	321	{321, 228, 2602, 84, 2071, 2428, 479}	7
2089	Eur Centro 	Affitto studio professionale Eur Centro Viale Europa proponiamo in affitto appartamento uso studio professionale piano alto composto da doppio ingresso 4 camere e grande sala riunioni doppi servizi 4 balconi cantina e posto auto coperto e 2.000,00 per informazioni rivolgersi ad Immobili & Imprese srl tel. 06/5923798 	Roma 	2.000 	 4 marzo, 22:54 	https://www.kijiji.it/annunci/affitto/roma-annunci-roma/eur-centro/77018930	2089	{2089, 208, 2225, 2481, 48, 411, 252}	7
2142	Ufficio 12 locali - Rif. LN13001 	CENTRO STORICO nei pressi di Largo di Torre Argentina - Via dell''Arco dei Ginnasi - proponiamo, la locazione di un prestigioso Ufficio di rappresentanza (A/10) in Palazzo d''epoca. L''ubicazione si presta a molteplici collegamenti con mezzi pubblici di superficie ; L''unità immobiliare, sita al primo piano, ha doppi ingressi e gode di affacci sia sulla strada di Via dell''Arco dei Ginnasi che su di una chiostrina interna, dando un''ottima luminosità a tutto l''ambiente ; la superficie di circa mq. 340 è suddivisa su due piani e si presta ad Uffici di alta rappresentanza ; uno dei due portoni di ingresso si apre su di un ampio salone con travi in legno a vista e colonne in marmo; attraverso varie porte, si accede ad altrettanti ampi locali ; il secondo portone di ingresso si affaccia su di una grande e moderna reception; l''ufficio nella sua interezza si compone di una sala riunione , cinque locali , quattro servizi , oltre a due locali con servizi che si trovano nel piano sovrastante a cui si accede attraverso un scala in legno. 	Roma 	5.500 	 3 marzo, 00:34 	https://www.kijiji.it/annunci/affitto/roma-annunci-roma/ufficio-12-locali-rif-ln13001/76929047	2142	{256, 2053, 495, 114, 2142, 190}	6
2191	Eur tintoretto 	EUR Ad. Tintoretto Proponiamo grazioso appartamento Arredato, posto al primo piano su palazzo di sette, con affaccio su ampio giardino condominiale iinterno, composto da : Soggiorno all''america con angolo cottura attrezzato, camera matrimoniale, bagno con doccia, cantina e posto auto coperto. L'' Immobile è dotato di impianto termico autonomo a gas metano e impianto di aria condizionata. Euro 750 Rif. Z-500 SI AFFITTA ESCLUSIVAMENTE AD INQUILINI REFERENZIATI ED IN POSSESSO DI UN REDDITO DOCUMENTATO Tel.06.53.55.67 www.ferrariemeriziola.it 	Roma 	750 	 2 marzo, 23:46 	https://www.kijiji.it/annunci/affitto/roma-annunci-roma/eur-tintoretto/76927857	2191	{2433, 450, 227, 2021, 2191, 2301}	6
2194	Eur corazzieri 	EUR CORAZZIERI in una bella palazzina disponiamo di un grande appartamento situato al piano terra con un grande giardino in parte pavimentato. L''immobile è stato appena ritinteggiato e risulta essere così composto. Dispone di due entrate: una principale, l''altra di servizio, un grande ingresso, salone doppio, 4 camere, una grande cucina con antistante una veranda molto spaziosa, doppi servizi e un grande giardino che gira tutt''intorno all''appartamento. E '' dotato di inferriate, porta blindata e un box per un'' auto. SI AFFITTA A PERSONE REFERENZIATE. euro 1.200,00. RIF. B-122. TEL. 06/50.43.347. www.ferrariemeriziola.it 	Roma 	1.200 	 2 marzo, 23:45 	https://www.kijiji.it/annunci/affitto/roma-annunci-roma/eur-corazzieri/76927849	2194	{2497, 2305, 335, 2194, 2450, 2622}	6
2171	Ufficio centro storico ad. Parlamento 	In palazzo d''epoca con servizio di porineria, proponiamo un uffcio posto al 2° piano di mq 95. L''immobile è da ristrutturare a cura e spese della proprietà con consegna a 90/120 giorni. Aria condizionata caldo/freddo centrallizzata. La richiesta è di euro 2.950,00 mensili. 	Roma 	2.950 	 2 marzo, 23:53 	https://www.kijiji.it/annunci/affitto/roma-annunci-roma/ufficio-centro-storico-ad-parlamento/76928012	2171	{320, 2594, 2379, 2062, 2291, 2171}	6
2185	Caratteristico ufficio nel cuore della città 	In via dei Coronari, grazioso ufficio al primo piano di un maestoso palazzo nobiliare del 1500. Una scala d''accesso conduce all''immobile di ca. 92mq composto da un accogliente ingresso, due spaziosi stanze con caratteristiche travi a vista originali e un bagno. In ottimo stato, la proprietà di recente ristrutturazione è fornita di aria condizionata e riscaldamento centralizzato. Disponibilità immediata. 	Roma 	2.200 	 2 marzo, 23:51 	https://www.kijiji.it/annunci/affitto/roma-annunci-roma/caratteristico-ufficio-nel-cuore-della-citta/76927972	2185	{356, 2185, 174, 2295, 2523, 2366}	6
2522	Moderno appartamento a Piazza di Spagna 	Piazza di Spagna - moderno appartamento sito al terzo piano di un palazzo d''epoca appena ristrutturato con ascensore. La proprietà, recentemente ristrutturata, si compone di ingresso con studiolo e bagnetto per gli ospiti, grande salone con parquet, due camere da letto, cucina e bagno con doccia. L''immobile dotato di riscaldamento centralizzato è molto silenzioso e luminoso. 	Roma 	3.200 	 14 febbraio, 06:50 	https://www.kijiji.it/annunci/affitto/roma-annunci-roma/moderno-appartamento-a-piazza-di-spagna/76167075	2522	{2176, 2599, 2426, 2066, 2265, 2522}	6
136	Monteverde vecchio 	MONTEVERDE VECCHIO Via Fonteiana Proponiamo l '' Affitto di un Locale commerciale di circa 240 mq Unico ambiente con Cucina a vista e doppi Servizi. Aria condizionata. Accesso da cancello elettrico. E 1600 Rif. Z-373 SI AFFITTA ESCLUSIVAMENTE AD INQUILINI REFERENZIATI ED IN POSSESSO DI UN REDDITO DOCUMENTATO Tel. 06.53.55.67 www.ferrariemeriziola.it 	Roma 	1.600 	 13 febbraio, 07:58 	https://www.kijiji.it/annunci/affitto/roma-annunci-roma/monteverde-vecchio/76113491	136	{288, 2503, 136, 2316, 2009, 2205}	6
138	Portuense vigna pia 	PORTUENSE VIGNA PIA In zona ben servita da mezzi pubblici, negozi di ogni genere, supermercati, nelle adiacenze di scuole e ospedale Proponiamo in locazione Appartamento al Piano Terra di circa 90 mq Vuoto con giardino di circa 100 mq così composto: ingresso, Corridoio, Armado a muro, Ampio Soggiorno, Camera da letto e Servizio. Tutte le Camere affacciano sul Giardino. L'' immobile è in buono stato, nelle spese di condominio è compreso il riscaldamento centralizzato, predisposizione al termoautonomo. E 1100 rif.Z-446 SI AFFITTA ESCLUSIVAMENTE AD INQUILINI REFERENZIATI ED IN POSSESSO DI UN REDDITO DOCUMENTATO Tel.06.53.55.67 www.ferrariemeriziola.it 	Roma 	1.100 	 13 febbraio, 07:57 	https://www.kijiji.it/annunci/affitto/roma-annunci-roma/portuense-vigna-pia/76113470	138	{290, 387, 2345, 138, 2318, 2207}	6
2199	Monteverde 	MONTEVERDE Via Paola Falconiere V Piano con ascensore Proponiamo in Affitto immobile Luminoso Semiarredato così composto: Ingresso, Ampio Soggiorno con Angolo cottura in muratura, Ampia Camera da letto con Bagno. Terrazzino vivibile attrezzato con Lavandino, attacco Lavatrice e Ringhiera di protezione. Euro 820 Rif. Z-498 SI AFFITTA ESCLUSIVAMENTE AD INQUILINI REFERENZIATI ED IN POSSESSO DI UN REDDITO DOCUMENTATO Tel.06.53.55.67 www.ferrariemeriziola.it 	Roma 	820 	 2 marzo, 23:45 	https://www.kijiji.it/annunci/affitto/roma-annunci-roma/monteverde/76927843	2199	{2310, 72, 2354, 150, 2199, 2552}	6
2198	Talenti 	TALENTI adiacente viale Jonio bellissimo appartamento di due camere di grande metratura. L''immobile si trova in uno stabile con un bel portierato: è composto da un ingresso, un salone, una camera matrimoniale, una grande cucina con tinello in cui si può mangiare comodamente, un bagno e un bel terrazzzino. E'' stato recentemente ristrutturato, le finestre sono con i doppi vetri in alluminio bianco. L''appartamento si affitta VUOTO con contratti di lunga durata, a persone referenziate. euro 750,00. RIF. B-129. TEL. 06/50.43.347. www.ferrariemeriziola.it 	Roma 	750 	 2 marzo, 23:45 	https://www.kijiji.it/annunci/affitto/roma-annunci-roma/talenti/76927845	2198	{2500, 2309, 70, 2353, 148, 2198}	6
2554	Portuense vigna pia 	PORTUENSE VIGNA PIA Via Felice Poggi In zona ben servita da mezzi pubblici e negozi, nelle vicinanze di supermercati, scuole ed ospedale Proponiamo in locazione Appartamento al piano Terzo di 90 mq circa Arredato e così composto: Ingresso, Armadio a muro, 3 Camere, Cucina, Servizio e Terrazzino verandato. L'' Immobile è in buono stato e nelle spese condoominiali è compreso il riscaldamento centralizzato. Euro 1000 Rif. Z-473 SI AFFITTA ESCLUSIVAMENTE AD INQUILINI REFERENZIATI ED IN POSSESSO DI UN REDDITO DOCUMENTATO Tel.06.53.55.67 www.ferrariemeriziola.it 	Roma 	1.000 	 14 febbraio, 02:03 	https://www.kijiji.it/annunci/affitto/roma-annunci-roma/portuense-vigna-pia/76154926	2554	{2201, 2312, 2511, 2356, 153, 2554}	6
2197	Montesacro citta' giardino 	MONTESACRO Città Giardino appartamento parzialmente arredato in stabile d''epoca composto da ingresso salone doppio, 2 camere, cucina abitabile, doppi servizi, balcone, terrazzo, cantina, posto auto coperto, termoautonomo Euro 1.200,00 Rif. B-120 Tel. 06/5043347 www.ferrariemeriziola.it SI AFFITTA ESCLUSIVAMENTE AD INQUILINI REFERENZIATI ED IN POSSESSO DI UN REDDITO DOCUMENTABILE 	Roma 	1.200 	 2 marzo, 23:45 	https://www.kijiji.it/annunci/affitto/roma-annunci-roma/montesacro-citta-giardino/76927846	2197	{2308, 68, 394, 2352, 340, 2197}	6
2138	Locale Pio XI 	Gregorio VII / Piazza Pio XI proponiamo un interessante negozio molto luminoso e di alta visibilità. Il negozio molto luminoso dispone di 3 ampie porte vetrina, ha una superficie di mq 80 al piano strada e mq 80 al piano interrato con altezza soffitti di mt 5, finestrato. Adatto per qualsiasi attività. La richiesta è di euro 4.000,00 mensili. Cl. En. G. 	Roma 	4.000 	 3 marzo, 02:02 	https://www.kijiji.it/annunci/affitto/roma-annunci-roma/locale-pio-xi/76930932	2138	{2051, 423, 2514, 2581, 2138, 187}	6
