	Title	Short Description	Location	Price (Euro)	Timestamp	Url Adv	doc_id	similar_docs	num_similar_docs
251	Eur Centro 	Affitto appartamento Eur Centro Viale Europa proponiamo in affitto appartamento piano alto composto da doppio ingresso salone doppio studio 3 camere cucina doppi servizi 4 balconi cantina e posto auto coperto e 2.000,00 per informazioni rivolgersi ad Immobili & Imprese srl tel. 06/5923798 	Roma 	2.000 	 13 febbraio, 01:45 	https://www.kijiji.it/annunci/affitto/roma-annunci-roma/eur-centro/76094468	251	{2088, 47, 2480, 207, 251, 412}	6
97	Locale adatto banca 	In porzione di alta visibilità a ridosso di Piazza fiume e di fronte alla Rinascente, proponiamo in locazione una interessante opportunità di un locale su due livelli fuori terra tutto accatastato C/1. Al piano strada mq 120 con 5 porte ad angolo ed al piano superiore mq 320 tutto finestrato. Completa la proprietà un locale ad uso magazzino di circa mq 20 sito al piano interrato. Possibilità di installare la canna fumaria. Il locale si presta per qualsiasi attività e anche per uffici e sportelli bancari. La richiesta mensile è di euro 16.000. 	Roma 	16.000 	 13 febbraio, 13:04 	https://www.kijiji.it/annunci/affitto/roma-annunci-roma/locale-adatto-banca/76131373	97	{97, 457, 2285, 2417, 314, 2588}	6
229	Accogliente appartamento dai toni pastello 	Questo centrale e luminoso appartamento si trova al primo piano di un palazzo storico di via Aureliana, nel rione Sallustiano. L''immobile, completamente ristrutturato ed arredato, è raggiungibile per mezzo di un elegante scala in stile art nouveau o con l''ascensore. Dall''ampio ingresso si raggiungono tutte le altre stanze, posizionate come i lati di una stella: una nuova moderna cucina interamente attrezzata, un ampio salone con numerose finestre e pavimento in marmo, due camere da letto con parquet e doppi servizi. Gli alti soffitti e le ampie finestre rendono particolarmente arioso e luminoso l''appartamento che dispone anche di una cantina. Via Aureliana, a ridosso del cuore di Roma, è ben servita dai mezzi pubblici anche per la vicinanza con piazza della Repubblica, la stazione Termini e Via Veneto. Libero da Aprile 2015. 	Roma 	1.800 	 13 febbraio, 02:11 	https://www.kijiji.it/annunci/affitto/roma-annunci-roma/accogliente-appartamento-dai-toni-pastello/76095411	229	{2565, 357, 229, 175, 408, 2367}	6
93	Locale commerciale Campo dei Fiori 	A ridosso di Campo dei Fiori, punto più movimentato della movida romana, proponiamo un locale commerciale tutto al piano strada di mq 210, di cui mq 160 di C/1 e mq 50 di C/2. Il locale è da ristrutturare e l''interno ha le pareti a mattoncini romani e i soffitti in legno ed è dotato di canna fumaria a norma. La richiesta è di euro 10.000,00 mensili. 	Roma 	10.000 	 13 febbraio, 13:05 	https://www.kijiji.it/annunci/affitto/roma-annunci-roma/locale-commerciale-campo-dei-fiori/76131451	93	{2281, 2413, 240, 310, 475, 93}	6
91	Appartamento ad. Parlamento 	In palazzo d''epoca con servizio di portineria, proponiamo un appartamento ristrutturato, posto al 5° piano, di mq 70. L''appartamento si compone di ingresso, ampio soggiorno, camera matrimoniale, cucina e bagno. Aria condizionata cado/freddo centralizzata. La richiesta è di euro 1960,00. 	Roma 	1.960 	 13 febbraio, 13:06 	https://www.kijiji.it/annunci/affitto/roma-annunci-roma/appartamento-ad-parlamento/76131498	91	{2279, 2411, 505, 238, 473, 91}	6
74	Trieste via del giuba locale commerciale 	TRIESTE VIA DEL GIUBA In zona commerciale Proponiamo in locazione Locale commerciale 40 mq circa posto al piano terra con 2 vetrine su strada Servizio e piccolo soppalco. Ottimo stato Pavimenti in parquet. Euro 800 Rif. Z-469 SI AFFITTA ESCLUSIVAMENTE AD INQUILINI REFERENZIATI ED IN POSSESSO DI UN REDDITO DOCUMENTATO Tel. 06.53.55.67 www.ferrariemeriziola.it 	Roma 	800 	 13 febbraio, 13:30 	https://www.kijiji.it/annunci/affitto/roma-annunci-roma/trieste-via-del-giuba-locale-commerciale/76132933	74	{2313, 74, 2357, 2202, 2555, 444}	6
61	Colombo Mura Aureliane 	Uffcio in affitto Via Cristoforo Colombo vicinanze mure aureliane in edificio direzionale con servizio di portineria e videosorveglianza proponiamo in affitto luminosissimo ufficio moderno ristrutturato e cablato di mq 158 posto al piano 5 composto 5 stanze sala riunioni doppi servizi con possibilità open space. Ubicato nelle vicinanze della metro B Garbatella e della Stazione Ostiense. Canone mensile euro 3300. Possibilità di posti auto coperti euro 150 al mese caduno. Per informazioni rivolgersi ad Immobil & Imprese srl tel. 06/5923798 	Roma 	3.300 	 13 febbraio, 22:30 	https://www.kijiji.it/annunci/affitto/roma-annunci-roma/colombo-mura-aureliane/76148937	61	{2220, 430, 2226, 2329, 61, 2462}	6
50	Tiburtina 	Affitto appartamento Tiburtina adiacente Polo Tecnologico proponiamo in affitto il palazzina di recente costruzione appartamento al secondo piano composto da ingresso soggiorno camera da letto cucina e bagno completano la proprietà 2 terrazzi la cantina ed il posto auto euro 600,00 immobili & imprese srl tel 06/5923798 	Roma 	600 	 13 febbraio, 22:31 	https://www.kijiji.it/annunci/affitto/roma-annunci-roma/tiburtina/76148984	50	{489, 2507, 2093, 50, 407, 377}	6
49	Montagnola 	Affitto appartamento Montagnola Via Salvatore di Giacomo proponiamo in locazione in palazzo in cortina con portiere ed ascensore appartamento primo piano composto da ingresso soggiorno camera matrimoniale cameretta cucina arredata bagno balconcino oltre posto auto coperto euro 950,00 per informazioni rivolgersi ad Immobili & Imprese srl tel 06/5923798 	Roma 	950 	 13 febbraio, 22:32 	https://www.kijiji.it/annunci/affitto/roma-annunci-roma/montagnola/76148997	49	{49, 2482, 210, 209, 2007, 410}	6
2612	San paolo 	SAN PAOLO Via Ostiense In Palazzina storica Ampio Appartamento posto al quinto piano di una palazzina storica di sei piani Ottima esposizione, Luminoso e così composto: Ingresso, 3 grandi Camere da letto, Ampia Cucina abitabile, 2 Servizi con doccia ( di cui uno con antibagno uso lavatoio), Comodo ripostiglio, Disimpegno uso studio. Riscaldamento Autonomo. L'' Immobile, data la vicinanza alla metro San Paolo si presta anche per uso ricettivo. Euro 1700 Rif. Z-483 SI AFFITTA ESCLUSIVAMENTE AD INQUILINI REFERENZIATI ED IN POSSESSO DI UN REDDITO DOCUMENTATO. Tel. 06.53.55.67 www.ferrariemeriziola.it 	Roma 	1.700 	 13 febbraio, 23:48 	https://www.kijiji.it/annunci/affitto/roma-annunci-roma/san-paolo/76151405	2612	{2114, 2019, 2439, 2612, 117, 158}	6
2614	Tiburtina 	TIBURTINA attico adiacente via dei Crispolti in ottimo stato vuoto composto da ingresso ampio soggiorno, 2 camere, cucina abitabile, doppi servizi, balcone perimetrale e grande terrazzo. Euro 1.150,oo Rif. B-03 Tel. 06/5043347 www.ferrariemeriziola.it SI AFFITTA ESLUSIVAMENTE AD INQUILINI REFERENZIATI ED IN POSSESSO DI UN REDDITO DOCUMENTABILE 	Roma 	1.150 	 13 febbraio, 23:48 	https://www.kijiji.it/annunci/affitto/roma-annunci-roma/tiburtina/76151398	2614	{160, 2116, 2441, 366, 2614, 2073}	6
2618	Marconi 	MARCONI a pochi passi dalle fermate della metro B San Paolo e Marconi proponiamo un appartamento in ottime condizioni interne completamente ristrutturato ed arredato composto da ingresso, salone, due camere da letto, doppi servizi di cui uno con box doccia e l''altro con vasca idromassaggio, cucina abitabile con accesso su una terrazza di circa 40 mq. Completano la proprietà un giardino di circa 100 mq e posto auto. Le finestre hanno le inferriate e lo stabile ha un servizio di portineria la mattina. Si valuta la locazione ad uso foresteria e comunque solo a referenziati con redditi dimostrabili. Euro 1.500,00 Rif. G-9 Tel. 06/700.88.92 www.ferrariemeriziola.it 	Roma 	1.500 	 13 febbraio, 23:48 	https://www.kijiji.it/annunci/affitto/roma-annunci-roma/marconi/76151391	2618	{481, 164, 367, 2618, 2076, 2525}	6
2014	Ostiense 	OSTIENSE adiacente Piramide locale commerciale accatastato C1 in buono stato, 2 porte, unico ambiente con piccolo retronegozio e servizio Euro 900,oo Rif. B-118 Tel.06/5043347 www.ferrariemeriziola.it SI AFFITTA ESCLUSIVAMENTE AD INQUILINI REFERENZIATI ED ID IN POSSESSO DI UN REDDITO DOCUMENTABILE 	Roma 	900 	 5 marzo, 02:23 	https://www.kijiji.it/annunci/affitto/roma-annunci-roma/ostiense/77025665	2014	{2515, 2014, 2360, 2108, 2558, 191}	6
2086	Locale Commmerciale 	Affitto locale commerciale Via Albano angolo Via Appia Nuova proponiamo in affitto un negozio libero con ottima visibiltà angolare, il locale è di circa 160 mq. con cinque ampie vetrine totalmente allestito per uno sportello bancario. Possibilità di ulteriori spazi commerciali adiacenti e canna fumaria. il canone di locazione mensile richiesto è di euro 6.000,00. per informazioni rivolgersi a Immobili & Imprese srl tel. 06/5923798. 	Roma 	6.000 	 4 marzo, 22:54 	https://www.kijiji.it/annunci/affitto/roma-annunci-roma/locale-commmerciale/77018938	2086	{2086, 2471, 205, 2478, 465, 2236}	6
291	Pineta sacchetti 	PINETA SACCHETTI Via Paolo V In piccola palazzinain Parco nel verde Proponiamo Ultimo Piano di 3 composto da 3 Camere (di cui una con Terrazzo) Cucina, 2 Bagni e scala interna che accede a terrazzo di copertura esclusiva di circa 100 mq. Riscaldamento autonomo, porta blindata. Ristrutturato e Arredato. Una Camera ha il camino Euro 1300 Rif. Z-410 Tel.06.53.55.67 www.ferrariemeriziola.it SI AFFITTA ESCLUSIVAMENTE AD INQUILINI REFERENZIATI ED IN POSSESSO DI UN REDDITO DOCUMENTATO. 	Roma 	1.300 	 13 febbraio, 00:24 	https://www.kijiji.it/annunci/affitto/roma-annunci-roma/pineta-sacchetti/76092080	291	{2208, 291, 388, 2346, 139, 368}	6
2358	Spinaceto 	"SPINACETO adiacente il mercato rionale del quartiere, ben collegata con autobus con i quali si raggiunge la fermata metro linea ""B"" Eur Fermi, proponiamo appartamento in locazione in buone condizioni interne composto da soggiorno a vista, due camere, cucina con tinello, doppi servizi, cantina e posto auto coperto condominiale. L''appartamento è disponibile da subito, ha il riscaldamento autonomo e viene consegnato ARREDATO. Contratto ad uso abitativo solo a referenziati in possesso di redditi dimostrabili. Euro 800,00 mensili rif.G-248 Tel.06/700.88.92 www.ferrariemeriziola.it "	Roma 	800 	 17 febbraio, 02:07 	https://www.kijiji.it/annunci/affitto/roma-annunci-roma/spinaceto/76295132	2358	{2314, 77, 2358, 2203, 2556}	5
2616	Portuense 	PORTUENSE L.GO LA LOGGIA, adiacente Via Portuense in Via degli Irlandesi , a pochi passi dalla Chiesa di S.Silvia , in palazzo di cortina recentemente ristrutturato, proponiamo la locazione di un appartamento in ottime condizioni interne, panoramico e luminoso posto al 6° piano di un palazzo di 7 , composto di ingresso, soggiorno con cucina a vista abitabile ,camera da letto, bagno e balcone. Situato in zona centrale, ricca di servizi e ben collegata sia al centro città che alla periferia grazie a 4 linee bus e metro leggera di superficie. Contratto transitorio, solo referenziati euro 790,00 Rif. G-5 Tel. 06/700.88.92 www.ferrariemeriziola.it 	Roma 	790 	 13 febbraio, 23:48 	https://www.kijiji.it/annunci/affitto/roma-annunci-roma/portuense/76151394	2616	{162, 2118, 2443, 2616, 2075}	5
401	Importante dimora storica nel cuore di Roma 	Appartamento di altissima rappresentanza di 900 mq al primo piano di uno storico palazzo del ''500 dotato di posto auto scoperto nel cortile e servizio di portineria. Per la sua notevole importanza è particolarmente adatto per ambasciate, associazioni bancarie ed uffici di altissima rappresentanza. L''immobile si trova nel cuore di Roma in uno dei luoghi più rinomati della città, nella suggestiva cornice di Piazza Mattei a due passi da Largo di Torre Argentina. Finemente ristrutturata, silenziosa, arredata con mobili di prestigio, la proprietà ha ampie finestre luminose e pavimentazione in marmo, maioliche e cotto antico, oltre che splendidi affreschi ed elementi di altissimo pregio. Composta da un doppio ingresso, con doppio ascensore, 16 vani, di cui 7 saloni affrescati con rilevanti opere pittoriche ed arredati con mobili di pregio, possibilità di cucina, 8 bagni con antibagno aria condizionata, riscaldamento autonomo. L''appartamento può essere dotato di un altro posto auto in box auto coperto a pagamento. Unico nel suo genere, si distingue per la sua particolare bellezza, per importanza storico e artistica ed eleganza. La disponibilità è immediata. 	Roma 	22.000 	 12 febbraio, 10:59 	https://www.kijiji.it/annunci/affitto/roma-annunci-roma/importante-dimora-storica-nel-cuore-di-roma/76062741	401	{167, 360, 2186, 401, 2258}	5
399	Monteverde colli portuensi 	MONTEVERDE COLLI PORTUENSI ad. Carrefour con fermata Atac antistante, proponiamo negozio C1 recentemente ristrutturato, su unico livello, composto da un ampio ambiente con caveau blindato, ripostiglio e bagno. L''immobile è rifinito con boiserie di pregio ed è dotato di impianto di aria condizionata. euro3.500 rif. Z-496 tel. 0655567 www.ferrariemeriziola.it 	Roma 	3.500 	 12 febbraio, 11:29 	https://www.kijiji.it/annunci/affitto/roma-annunci-roma/monteverde-colli-portuensi/76064186	399	{225, 2190, 399, 82, 2300}	5
173	Piano alto in dimora storica del '500 	Appartamento di charme in dimora storica del ''500 con servizio di portineria a due passi da Piazza Navona. L''appartamento ubicato al terzo ed ultimo piano con ascensore, si compone di un ingresso con porta blindata, stanza da letto con armadio a muro e bagno, cucina abitabile, stanza da pranzo, studio/camera da letto, salone di rappresentanza, studio, due bagni, terrazzo. L''appartamento è caratterizzato dall''alto soffitto con travi a vista, dall''arredamento classico ed elegante e da un bel terrazzo di 35 mq con vista sui tetti di Roma. La proprietà è dotata di aria condizionata e riscaldamento autonomo. Disponibilità di un eventuale posto auto. No attività ricettive, B&B e case vacanze. 	Roma 	4.500 	 13 febbraio, 07:41 	https://www.kijiji.it/annunci/affitto/roma-annunci-roma/piano-alto-in-dimora-storica-del-500/76112732	173	{2564, 2248, 173, 2070, 2365}	5
2534	Eur Torrino 	Affitto ufficio Eur Torrino Via Fiume Bianco in palazzo ad uffici con portiere e videosorveglianza proponiamo in affitto moderno ufficio luminosissimo in ottimo stato posto al piano sesto composto da reception 11 stanza sala riunioni doppi servizi, possibilità open space, disponibilità di posti auto esterni e magazzini. euro 6.700,00 mensili. Per informazioni rivolgersi a Immobili & Imprese srl tel. 06/5923798 	Roma 	6.700 	 14 febbraio, 04:25 	https://www.kijiji.it/annunci/affitto/roma-annunci-roma/eur-torrino/76160684	2534	{1986, 2085, 2534, 204, 351}	5
2615	Monteverde c.ne gianicolense 	C. GIANICOLENSE di fronte all''ospedale S. Camillo proponiamo app.to posto al primo piano di palazzina di cinque con doppia esposizione, composto da soggiorno, due camere, ampia cuicina abitabile, doppi servizi, soppalco ripostiglio, tre balconi. euro1000 rif. Z-487 tel. 06535567 www.ferrariemeriziola.it SI AFFITTA ESCLUSIVAMENTE A PERSONE REFERENZIATE IN POSSESSO DI REDDITO DOCUMENTATO. 	Roma 	1.000 	 13 febbraio, 23:48 	https://www.kijiji.it/annunci/affitto/roma-annunci-roma/monteverde-c-ne-gianicolense/76151396	2615	{161, 2117, 2442, 2615, 2074}	5
536	Stabile - Rif. BS011 	Centro Storico Piazza del Popolo immediate vicinanze. Palazzo uffici su tre livelli di 1600 mq con grande terrazza - roof garden panoramica. Tel. 06.36006910 	Roma 	Contatta l'utente 	 11 febbraio, 20:29 	https://www.kijiji.it/annunci/affitto/roma-annunci-roma/stabile-rif-bs011/76029859	536	{376, 488, 297, 2092, 536}	5
398	Monteverde vecchio 	MONTEVERDE VECCHIO VIA VITELLIA di fronte ingresso Villa Panphili in stabile del ''600 antiche scuderie, proponiamo grazioso appartamento bilivelli, ben arredato, recentemente ristrutturato con materiali di alta qualità, composto al primo livello da soggiorno con angolo cottura e giardinetto pavimentato, al secondo livello camera da letto, bagno con doccia tutto in marmo, cabina armdio. termoautonomo, euro850 rif. Z-495 tel. 06.535567 www.ferrariemeriziola.it SI AFFITTA ESCLUSIVAMENTE AD INQUILINI REFERENZIATI IN POSSESSO DI REDDITO DOCUMENTATO 	Roma 	850 	 12 febbraio, 11:30 	https://www.kijiji.it/annunci/affitto/roma-annunci-roma/monteverde-vecchio/76064194	398	{224, 2189, 398, 81, 2299}	5
2560	Ardeatina grottaperfetta 	ARDEATINA GROTTAPERFETTA appartamento in ottimo stato completamente arredato composto da ampio salone all''americana, 3 camere, cucina abitabile, doppi servizi, 2 balconi, posto auto coperto in garage condominiale e cantina. Termoautonomo. Euro 1.250,oo Rif. B-132 Tel. 06/5043347 www.ferrariemeriziola.it SI AFFITTA ESCLUSIVAMENTE AD INQUILINI REFERENZIATI ED IN POSSESSO DI UN REDDITO DOCUMENTABILE 	Roma 	1.250 	 14 febbraio, 02:03 	https://www.kijiji.it/annunci/affitto/roma-annunci-roma/ardeatina-grottaperfetta/76154915	2560	{2560, 197, 2362, 2110, 2015}	5
2566	Elegante appartamento in stile classico 	Balduina ? in prossimità di Piazza Giovenale e del parco di Monte Ciocci, signorile proprietà semi ammobiliata, sita al primo piano di una palazzina con viale privato. L''immobile, silenzioso ed in ottimo stato, si compone di un ingresso, doppio salone, sala pranzo, cucina completa ed ultra moderna, studio con accesso al balcone, due camere da letto entrambe con bagno en-suite e cabine armadio, terzo bagno e grazioso balcone. La proprietà è dotata di parquet doussie, estremamente resistente, di numerosi e raffinati armadi a muro e librerie su misura. Completano le dotazioni dell''immobile l''impianto di aria condizionata, un posto auto scoperto ed un posto auto in garage. Disponibile dal 15/01/2015. 	Roma 	2.250 	 14 febbraio, 01:56 	https://www.kijiji.it/annunci/affitto/roma-annunci-roma/elegante-appartamento-in-stile-classico/76154707	2566	{257, 2566, 2063, 2423, 2296}	5
2447	Portuense vigna pia quadrilocale affitto 	PORTUENSE VIGNA PIA In zona ben servita di ogni genere di negozio, supermercati, scuole ospedale e mezzi pubblici In palazzina in cortina Proponiamo l ''Affitto di un Appartamento posto al terzo piano con ascensore Semiarredato cosi'' composto: Ampio Ingresso, Soggiorno, 3 Camere da letto, Cucina e Grande Bagno. E'' Possibile togliendo una parete di cartongesso trasformare l'' immobile in Salone doppio e 2 Camere da letto. Termoautonomo. Euro 1200 Rif. Z-445 SI AFFITTA ESCLUSIVAMENTE AD INQUILINI REFERENZIATI ED IN POSSESSO DI UN REDDITO DOCUMENTATO Tel.06.53.55.67 www.ferrariemeriziola.it 	Roma 	1.200 	 16 febbraio, 23:46 	https://www.kijiji.it/annunci/affitto/roma-annunci-roma/portuense-vigna-pia-quadrilocale-affitto/76291660	2447	{2447, 2544, 118, 2105, 2237}	5
405	Ufficio - Rif. CH1 	Prati Via di Cola di Rienzo all''interno di uno stabile di rappresentanza si affittano uffici da 653 mq a piano. Gli uffici possono essere affittati anche per porzione di piano da un minimo di 150 mq oppure si possono affittare più piani per un totale di 3.200 mq. Tel. 06.36006910 	Roma 	13.000 	 12 febbraio, 10:58 	https://www.kijiji.it/annunci/affitto/roma-annunci-roma/ufficio-rif-ch1/76062692	405	{491, 2509, 2095, 405, 379}	5
2448	Eur v.le dell'aeronautica 	EUR ad. V.le dell''Aeronautica proponiamo appartamento vuoto, posto al secondo piano di palazzina signorile di cinque con servizio di portierato, composto da ingresso, soggiorno, camera matrimoniale, studio, cucina abitabile, bagno con vasca, ripostiglio, balcone. L''immobile è dotato di impianto termico autonomo. euro 850 rif. Z-450 tel. 06.535567 www.ferrariemeriziola.it SI AFFITTA ESCLUSIVAMENTE A PERSONE REFERENZIATE CON REDDITO DOCUMENTABILE. 	Roma 	850 	 16 febbraio, 23:46 	https://www.kijiji.it/annunci/affitto/roma-annunci-roma/eur-v-le-dell-aeronautica/76291655	2448	{332, 2448, 533, 2106, 2620}	5
2022	Eur 	EUR Via del Serafico Proponiamo grazioso Superattico Arredato, altezza soffitti 2,30 Posto al settimo ed ultimo piano, doppia esposizione, composto da: Soggiorno all'' americana con cucina a vista, Camera matrimoniale, Bagno con doccia, 3 piccole terrazzine (8/7/5 mq), Posto auto scoperto. Euro 850 Rif.Z-497 SI AFFITTA ESCLUSIVAMENTE AD INQUILINI REFERENZIATI ED IN POSSESSO DI UN REDDITO DOCUMENTATO. Tel.06.53.55.67 www.ferrariemeriziola.it 	Roma 	850 	 5 marzo, 02:22 	https://www.kijiji.it/annunci/affitto/roma-annunci-roma/eur/77025616	2022	{2434, 2022, 2192, 2608, 2302}	5
404	Ufficio - Rif. CH1a 	Prati Via di Cola di Rienzo all''interno di uno stabile di rappresentanza si affittano uffici di 350 mq. Gli uffici possono essere affittati anche per porzione di piano da un minimo di 150 mq ad un massimo di 653 mq, oppure si possono affittare più piani per un totale di 3.200 mq. Tel. 06.36006910 	Roma 	6.500 	 12 febbraio, 10:58 	https://www.kijiji.it/annunci/affitto/roma-annunci-roma/ufficio-rif-ch1a/76062695	404	{2504, 1996, 404, 2453, 380}	5
474	Negozio - Rif. E74-04-01 	Nel cuore del centro storico a due passi dal Pantheon, in posizione di elevato passaggio pedonale, proponiamo la locazione di un''ottima opportunità commerciale di un negozio di mq 30 di forma quadrata e con un''ampia porta d''ingresso. Il locale è dotato di servizio. Completa la proprietà un locale cantina di mq 15 circa con ingresso dl portone laterale. No canna fumaria. La richiesta è di euro 8.000,00 + buonauscita. 	Roma 	8.000 	 12 febbraio, 00:17 	https://www.kijiji.it/annunci/affitto/roma-annunci-roma/negozio-rif-e74-04-01/76035585	474	{2280, 2412, 239, 474, 92}	5
2536	Colombo Mura Aureliane 	Uffcio in affitto Via Cristoforo Colombo vicinanze mure aureliane in edificio direzionale con servizio di portineria e videosorveglianza proponiamo in affitto ufficio moderno ristrutturato e cablato di mq 830 posto al piano 1 composto 16 stanze sale riunioni quattro bagni sala break con possibilità open space. Ubicato nelle vicinanze della metro B Garbatella e della Stazione Ostiense. Canone mensile euro 17000. Possibilità di posti auto coperti euro 150 al mese caduno. Per informazioni rivolgersi ad Immobil & Imprese srl tel. 06/5923798 	Roma 	17.000 	 14 febbraio, 04:08 	https://www.kijiji.it/annunci/affitto/roma-annunci-roma/colombo-mura-aureliane/76159887	2536	{129, 2084, 2536, 203, 2235}	5
2427	Ufficio in contesto esclusivo nel centro di Roma 	Ufficio di circa 222 mq in splendida dimora storica, con servizio di portineria H24, a due passi da Piazza della Chiesa Nuova. L''immobile, completamente ristrutturato, si sviluppa al piano seminterrato e si compone di ingresso-reception, tre stanze operative, due bagni, e grande ripostiglio. La proprietà luminosa, offre eleganti soffitti a volta, impianto di aria condizionata, e riscaldamento centralizzato. Per il contesto esclusivo della location è la sede ideale per uffici, showroom e gallerie d''arte. 	Roma 	2.500 	 16 febbraio, 23:53 	https://www.kijiji.it/annunci/affitto/roma-annunci-roma/ufficio-in-contesto-esclusivo-nel-centro-di-roma/76291814	2427	{2240, 2177, 2427, 2067, 2331}	5
86	Ufficio di rappresentanza in dimora storica 	Ufficio di grande rappresentanza di circa 700 mq e 50 mq di soppalco, con triplo affaccio in dimora storica del 1500. L''immobile è ubicato al piano nobile del palazzo con ascensore e servizio di portineria e si compone di un doppio ingresso con due ascensori, 15 vani, 7 bagni, un comodo cucinotto. L''ufficio è luminoso, completamente ristrutturato e cablato e si distingue per gli ampi saloni, i soffitti a cassettoni alti più di 5 metri e affrescati, i climatizzatori in tutte le sale, splendidi affacci sia esterni che sul bellissimo cortile. A seconda delle esigenze, l''ampia metratura dell''immobile consente una suddivisione dei diversi ambienti lavorativi come operatività/rappresentanza. L''immobile è caratterizzato inoltre dai comodi spazi soppalcati con armadi su misura, vani per archivi, pavimentazione originale che si può ammirare in alcune sale. Sede ideale per multinazionali, banche e studi associati. La disponibilità è immediata e si richiedono referenze. 	Roma 	17.000 	 13 febbraio, 13:11 	https://www.kijiji.it/annunci/affitto/roma-annunci-roma/ufficio-di-rappresentanza-in-dimora-storica/76131805	86	{323, 2182, 2604, 2262, 86}	5
502	Appartamento - Rif. E74-04-21 	In stabile con servizio di portineria, proponiamo un appartamento di mq 170, posto al sesto piano. Riscaldamento centralizzato. La richiesta è di euro 2.200,00 mensili. 	Roma 	2.200 	 11 febbraio, 22:11 	https://www.kijiji.it/annunci/affitto/roma-annunci-roma/appartamento-rif-e74-04-21/76031993	502	{235, 2576, 2132, 502, 2042}	5
85	Delizioso attico nel cuore di Roma 	Tra via Giulia e Piazza Navona, elegante open space su due livelli in palazzo d''epoca con ascensore. La proprietà molto luminosa si compone, al piano inferiore, di ingresso, camera da letto, bagno e balconcino. Il piano superiore, fornito di ampio terrazzo al quale si accede tramite porta finestra e di una graziosa veranda, ospita la zona giorno, il vano cucina a vista ed un bagno. L''appartamento, termoautonomo, si apre su uno spazioso terrazzo con vista sul Parco del Gianicolo. 	Roma 	2.200 	 13 febbraio, 13:11 	https://www.kijiji.it/annunci/affitto/roma-annunci-roma/delizioso-attico-nel-cuore-di-roma/76131808	85	{480, 322, 2603, 85, 2072}	5
490	Stabile - Rif. CF14 	Nomentano adiacente Villa Torlonia inizio di Via Catania immobile fine anni trenta recentemente ristrutturato di 7 piani fuori terra ad uffici e 2 piani seminterrati ad archivi, per un totale di circa 3.500 mq. Servito da due scale e tre ascensori. E'' presente un parcheggio interno più un''area esterna utilizzabile come ulteriore parcheggio per un totale di 450 mq. Il canone di locazione è pari a euro 90.000/mese. Per info 06.36006910 	Roma 	90.000 	 11 febbraio, 23:20 	https://www.kijiji.it/annunci/affitto/roma-annunci-roma/stabile-rif-cf14/76034103	490	{490, 2508, 2094, 406, 378}	5
