	Title	Short Description	Location	Price (Euro)	Timestamp	Url Adv	doc_id	similar_docs	num_similar_docs
1799	Agrituriamo La Muratella rif. 504284 	La struttura si distingue per la tranquillità, il verde nel quale è immersa, pur essendo a pochi km da Roma e da Fiumicino, nonché dalla Fiera di Roma, dalle Terme di Qc Terme di Roma, da Ostia Antica e Fregene. Oltre al vicino mare di Fregene e di Maccarese, a pochi km dall'agriturismo si trovano un maneggio e le Terme dell'hotel Qc terme Roma, che offrono sconti in convenzione ai clienti della nostra struttura. La nostra struttura e' ideale per le famiglie, per il parco che offre ai bambini e la tranquillità del verde nel quale è immersa, ideale per rilassarsi dopo le gite in città. - Agriturismo La Muratella 	Eur / Portuense / Magliana 	Contatta l'utente 	 15 aprile, 09:29 	https://www.kijiji.it/annunci/affitto/roma-annunci-eur-portuense-magliana/agrituriamo-la-muratella-rif-504284/137172559	1799	{1798, 1799}	2
296	Affitto bilocale arredato Terrazze del Presidente 	Axa - comprensorio Terrazze del Presidente, affittasi splendido immobile sito al 5° piano composto da ingresso, soggiorno, camera matrimoniale, cucina, bagno, terrazza, posto auto, completamente e finemente ammobiliato. euro 700 (504-01P) 	Roma 	700 	 13 febbraio, 00:21 	https://www.kijiji.it/annunci/affitto/roma-annunci-roma/affitto-bilocale-arredato-terrazze-del-presidente/76092005	296	{296, 348}	2
888	Montesacro: Signorile,Trilocale Ottimo Stato Parz. Arredato 	VIA NICOLA MARCHESE: In complesso residenziale nel verde con servizio di portineria , proponiamo in locazione appartamento in ottimo stato interno posto al piano primo, con affacci interni nel comprensorio per cui riservato e silenzioso. Internamento è composto da soggiorno con ampio angolo cottura, camera matrimoniale, camera singola, bagno con vasca, secondo bagno/lavatoio e ampia balconata perimetrale. L'appartamento viene affittato parzialmente arredato di : cucina completa, soggiorno e in parte la camera matrimoniale. Troviamo inferriate di protezione e porta blindata,. LIBERO DA OTTOBRE 2019 SI PRENDONO IN CONSIDERAZIONE SOLO PERSONE CON REFERENZE DOCUMENTABILI. Per qualsiasi altra informazione contattare il: 3469602066 	Roma 	1.000 	 26 settembre, 06:32 	https://www.kijiji.it/annunci/affitto/roma-annunci-roma/montesacro-signorile-trilocale-ottimo-stato-parz-arredato/143336633	888	{888, 1123}	2
333	Trastevere 	TRSTEVERE Via Garibaldi In zona esclusiva a due passi da Trastevere e dal Gianicolo Immerso nel verde Proponiamo l'' Affitto di un villino a schiera Bilivelli in complesso con portierato, completamente ristrutturato Semiarredato o Arredato completamente così composto: Piano Terra: Soggiorno con caminetto, Sala da Pranzo, Angolo cottura e Lavanderia; Primo Piano: Camera da letto con armadio a muro, Bagno e Terrazzino. Completa la proprietà un giardino di esclusiva pertinenza ( circa 30 mq). L'' Immobile è dotato doi condizionatori, inferriate e cassaforte. Termoautonomo. Possibilità di Posto Auto sorvegliato. Euro 2000 Rif. Z-454 SI AFFITTA ESCLUSIVAMENTE AD INQUILINI REFERENZIATI ED IN POSSESSO DI UN REDDITO DOCUMENTATO. Tel. 06.53.55.67 www.ferrariemeriziola.it 	Roma 	2.000 	 12 febbraio, 23:00 	https://www.kijiji.it/annunci/affitto/roma-annunci-roma/trastevere/76089331	333	{2488, 333}	2
665	"Appartamento a ROMA - Tiburtina ""Metro Rebibbia"" "	"L'immobile è collocato nelle adiacenze di un gradevole Circolo privato sportivo, a circa mt. 400 dalla fermata Metro ""Rebibbia"", capolinea della linea B. Lo Stabile nel quale si trova è di soli due piani e beneficia di accoglienti aree condominiali verdi e di comodi spazi riservati al parcheggio delle auto e moto. L'appartamento è sito al piano terra ed è composto da un'ampia Camera, Cucinotto, bagno, un gradevole terrazzo ed un posto auto condominiale. Può essere locato vuoto o arredato, senza variazioni di canone. Il contratto è ad uso abitativo e costituisce elemento di selezione, nella scelta del potenziale inquilino, la presenza di un reddito documentabile (classe energetica G - Ipe 125,11 kWh/mq anno). Description: The property is located near of a pleasant private sports club, about 400 mt. from the ""Rebibbia"" Metro stop of B line. The Stable is only two floors and benefits from welcoming green condominiums and comfortable spaces reserved for car and motorbike parking. The apartment is located on the ground floor and consists of a large Bedroom, a fitted Kitchen, a Bathroom, a nice Terrace and a shared car space. It can be rented empty or furnished, without any variation of canon. The contract is for housing and constitutes a selection item in the choice of potential tenant, the presence of a documentable income (classe energetica G - Ipe 125,11 kWh/mq anno). "	Tiburtino / Collatino 	600 	 7 ottobre, 01:42 	https://www.kijiji.it/annunci/affitto/roma-annunci-tiburtino-collatino/appartamento-a-roma-tiburtina-metro-rebibbia/134616711	665	{665, 1027}	2
1399	Appartamento arredato via prenestina 	Prenestina (serenissima) affittasi appartamento completamente arredato e ristutturato, composto da soggiorno spazioso, camera matrimoniale, cucina abitabile, bagno con vasca e lavabiancheria, ampio ingresso e balconcino. piano medio, molto luminoso, ottimo affaccio, riscaldamento autonomo. spese condominiali comprese. collegatissimo con il centro ed universitaâ€™. libero da subito, contratto. astenersi agenzie ed intermediari. 	Prenestino / Casilino 	850 	 4 settembre, 11:09 	https://www.kijiji.it/annunci/affitto/roma-annunci-prenestino-casilino/appartamento-arredato-via-prenestina/142255309	1399	{1117, 1399}	2
598	Bilocale - metro b1 annibaliano 	Codice annuncio*18597* zona trieste - a 900 mt a piedi da metro b1 annibaliano appartamento di 30 mq arredato e ristrutturato composto da camera da letto, cucina abitabile e bagno balcone e terrazzo 700€ mensili per info chiamare il numero 0677071561 	Roma 	700 	 9 ottobre, 04:58 	https://www.kijiji.it/annunci/affitto/roma-annunci-roma/bilocale-metro-b1-annibaliano/143904043	598	{2161, 598}	2
329	Trastevere 	TRASTEVERE Vicolo Moroni in palazzina storica senza ascensore Ottima esposizione Luminoso e'' cosi'' composto: Ingresso,Soggiorno con doppia finestra, Cucinotto, Camera da letto con grande armadio a muro e Servizio interno. L'' Immobile rifinito e Arredato completamente è provvisto di soffitti travi a vista, parquet e marmi , Riscaldamento Autonomo e Porta Blindata. Euro 1200 No spese di condominio Rif. Z-493 SI AFFITTA ESCLUSIVAMENTE AD INQUILINI REFERENZIATI ED IN POSSESSO DI UN REDDITO DOCUMENTATO Tel. 06.53.55.67 www.ferrariemeriziola.it 	Roma 	1.200 	 12 febbraio, 23:01 	https://www.kijiji.it/annunci/affitto/roma-annunci-roma/trastevere/76089362	329	{329, 195}	2
1391	Appartamento bilivelli 	ARDEATINA MILLEVOI DEA DI ROMA Nel Complesso Residenza Erica app.to bilivelli al p.terra e seminterrato con doppio ingresso al p.terra soggiorno cucina camera bagno balconi e giardino al piano seminterrato due camere e bagno completa la proprietà un posto auto e un box no ag. 	~Altre zone 	1.250 	 5 settembre, 00:01 	https://www.kijiji.it/annunci/affitto/roma-annunci-altre-zone/appartamento-bilivelli/138134979	1391	{1922, 1391}	2
1039	Viale cortina d'ampezzo-via vallombrosa 2° piano arredato 	Viale cortina d'ampezzo - VIA VALLOMBROSA -in elegante e tranquillo contesto residenziale appartamento di recente costruzione posto al 2° piano molto luminoso composto da soggiorno, cucina con finestra, disimpegno, bagno in marmo con doccia idromassaggio e finestra, camera da letto, terrazzo di mq 15, pavimento in vero parquet. Appena ristrutturato. Porta blindata, ascensore, tv, forno, lavastoviglie, lavatrice, termoautonomo. Servizio di portineria. Contratto di locazione 4+4. Solo referenziati. Animali non ammessi. Assolutamente no agenzie immobiliari. 	Roma 	990 	 19 settembre, 16:29 	https://www.kijiji.it/annunci/affitto/roma-annunci-roma/viale-cortina-d-ampezzo-via-vallombrosa-2a-piano-arredato/143065414	1039	{1003, 1039}	2
2024	Tuscolana 	FRONTE VILLA LAIS (Santa Maria Ausiliatrice) proponiamo in locazione un piano alto, luminoso ed esterno con panorama 180 gradi. L''appartamento è in ottime condizioni ed arredato. Si presenta con un ampio ingresso un comodo saloncino con cucinotto ampia camera una cameretta bagno ed ampia balconata che abbraccia tutto l''appartamento. La prossimità a numerosi servizi pubblici come autobus e metro A rendono facile e veloce il raggiungimento del centro, mentre Villa Lazzaroni, Villa Lais ed il parco della Caffarella sono raggiungibili con una comoda e piacevole passeggiata di pochi minuti. Qualsiasi tipologia di contratto purchè persone con referenze dimostrabili. Euro 870,00 Rif. G-21 Tel.06/700.88.92 www.ferrariemeriziola.it 	Roma 	870 	 5 marzo, 02:22 	https://www.kijiji.it/annunci/affitto/roma-annunci-roma/tuscolana/77025608	2024	{2024, 2119}	2
2025	Mostacciano ad. via jachino 	MOSTACCIANO Ad. Via Jachino Proponiamo Appartamento posto al Piano Terra di palazzina di tre, con doppia esposizione, Arredato, composto da: Soggiorno all'' americana con Cucina a vista, Camera matrimoniale, Bagno con doccia e Ripostiglio. L'' Immobile è dotato di impianto Termoautonomo. Euro 700 Rif. Z-505 SI AFFITTA ESCLUSIVAMENTE AD INQUILINI REFERENZIATI ED IN POSSESSO DI UN REDDITO DOCUMENTATO Tel. 06.53.55.67 www.ferrariemeriziola.it 	Roma 	700 	 5 marzo, 02:21 	https://www.kijiji.it/annunci/affitto/roma-annunci-roma/mostacciano-ad-via-jachino/77025596	2025	{2256, 2025}	2
2026	Flaminio 	FLAMINIO PIAZZALE DELLE BELLE ARTI sul Lungotevere delle Navi disponiamo di un immobile che è stato recentemente ristrutturato e si presenta in ottime condizioni. Ha un entrata indipendente pur facente parte di un condominio. Si salgono pochi scalini e ci si trova in un disimpegno dal quale si apre il portone d''ingresso. L''immobile risulta essere così composto: ingresso ampio, 3 grandi camere con parquet e soffitti alti decorati, un''altra camera di dimensioni inferiori alle altre ma pur sempre comoda, una cucina, un bagno con doccia, una zona ripostiglio. il riscaldamento è autonomo e si affitta VUOTO. euro 1.900,00. RIF. B-09. TEL. 06/50.43.347. www.ferrariemeriziola.it 	Roma 	1.900 	 5 marzo, 02:21 	https://www.kijiji.it/annunci/affitto/roma-annunci-roma/flaminio/77025586	2026	{2026, 2239}	2
734	Appartamento Piazza Fiume Porta Pia 	PIAZZA FIUME - A due passi dal centro storico adiacente piazza fiume e porta pia si affitta in stabile d'epoca piano alto ampio appartamento composto da quattro camere, cucina abitabile, bagno e ripostiglio. Possibilità struttura ricettiva. E.2100. [G-175 Kwh/m2/anno]. Per informazioni tel o whatsapp al 389.6896883. 	Roma 	2.100 	 4 ottobre, 06:31 	https://www.kijiji.it/annunci/affitto/roma-annunci-roma/appartamento-piazza-fiume-porta-pia/143704639	734	{734, 39}	2
293	Ostia affittasi locale commerciale 	OSTIA via delle Baleniere in zona commercialmente strategica affittasi locale commerciale in posizione angolare con 4 vetrine. 	Roma 	5.000 	 13 febbraio, 00:23 	https://www.kijiji.it/annunci/affitto/roma-annunci-roma/ostia-affittasi-locale-commerciale/76092065	293	{293, 383}	2
1382	Bilocale P.Tola zona Metro A Furio Camillo 	Via Pasquale Tola bilocale, terzo piano aria condizionata Ascensore zona metro a appia re di roma Bagno cucina con zona soggiorno e camera con grande cabina armadio letto matrimoniale No Agenzia, contattami via email o su whatsapp disponibilità anche in altre zone disponibilità immediata. Contratto regolare registrato transitorio SOLO per non residenti studenti lavoratori o altre esigenze transitorie - durata: Minimo 1 mese - Due mesi deposito cauzionale 	Roma 	820 	 5 settembre, 08:43 	https://www.kijiji.it/annunci/affitto/roma-annunci-roma/bilocale-p-tola-zona-metro-a-furio-camillo/120226661	1382	{1266, 1382}	2
1585	Singola 	Cercasi studentessa o lavoratrice dai 26 anni in su, affitto stanza singola sulla Tiburtina (10 min a piedi dalla stazione). La casa è composta da altre 2 singole, salotto bagno e cucina. Spese escluse internet, luce e gas, mentre sono incluse acqua, condominio e immondizia. Zona dotata di comfort e fermata dell'autobus sotto casa. Valentina 3342138191 - Maria 340 2154371. Libera da subito 	Tiburtino / Collatino 	400 	 19 agosto, 12:50 	https://www.kijiji.it/annunci/affitto/roma-annunci-tiburtino-collatino/singola/141887137	1585	{1561, 1585}	2
2261	Prestigioso ufficio in palazzo cinquecentesco 	Ufficio di alta rappresentanza di ca. 360 mq, ubicato al primo piano di un palazzo di fine ''500 in Corso Vittorio Emanuele, a due passi dalle principali sedi politiche nazionali. Privo di arredi, l''immobile si compone di un ingresso, 8 vani, 4 bagni ed è caratterizzato da ampi saloni, soffitti alti con importanti affreschi, porte decorate, camino e una balconata in pietra. La proprietà necessità di ristrutturazione e disponibile da subito e vi è anche la possibilità di locare un posto auto nella corte interna. 	Roma 	5.400 	 2 marzo, 02:10 	https://www.kijiji.it/annunci/affitto/roma-annunci-roma/prestigioso-ufficio-in-palazzo-cinquecentesco/76887010	2261	{171, 2261}	2
1344	Marconi locale C/1 adatto studio prof.le ristr to 2 ambienti 	Viale Marconi - locale C/1 ristrutturato parquet mq 25 adatto a studio professionale suddiviso in due stanze con porte -clima- bagno. I due ambienti sono rispettivamente di mq 15 e mq 10- portoncino in alluminio anodizzato bianco.CL EN G-E 350+ 20 cond. al mese. contratto 6+6 con cedolare solo referenziati con garanzie concrete.tel 3467210149 A.I 	Roma 	350 	 6 settembre, 17:31 	https://www.kijiji.it/annunci/affitto/roma-annunci-roma/marconi-locale-c-1-adatto-studio-prof-le-ristr-to-2/142348576	1344	{1344, 1913}	2
1345	Camera Stanza Singola San Giovanni 	L'appartamento termoautonomo è situato in zona centrale servita dalle principali linee di trasporti, a pochi passi si trovano le stazioni delle metropolitane A e C nonchè varie linee autobus. La casa ha 3 stanze, ed è composta da un ampio ingresso con divano, cucina e bagno che sono in condivisione tra le stanze. L'immobile è dotato di aria condizionata e wifi. La camera ha un letto matrimoniale, un grande armadio, una scrivania. 	San Giovanni / Appio Latino / Ardeatino 	500 	 6 settembre, 17:31 	https://www.kijiji.it/annunci/affitto/roma-annunci-san-giovanni-appio-latino-ardeatino/camera-stanza-singola-san-giovanni/142186696	1345	{1345, 1346}	2
2052	Appartamento trilocale 	In palazzo d''epoca di prestigio con servizio di portineria, proponiamo un appartamento posto al quinto piano di sei con una superficie coperta di mq 140 composto da: ampio ingresso, soggiorno-pranzo, tyre camere matrimoniale, cucina abitabile, doppi servizi, completa la proprietà un terrazzo a livello di mq 22.. L''appartamento è in buono stato i pavimenti sono in parquet ed il riscaldamento è centralizzato. La richiesta è di euro 3.630,00 mese. 	Roma 	3.630 	 5 marzo, 02:11 	https://www.kijiji.it/annunci/affitto/roma-annunci-roma/appartamento-trilocale/77025255	2052	{2052, 2140}	2
1365	Affitto Locale C1 mq. 190 - Via di Borghesiana 	LOCALE COMMERCIALE C/1 mq. 190 - Via Borghesiana/Prenestina Proponiamo in affitto un ampio locale commerciale categoria C/1 in buono stato, di 190 mq. con altezza di 4,80 metri e parcheggio esterno per quattro auto. Il locale è posizionato in via di Borghesiana adiacente alla Prenestina. A circa 400 metri da Via Prenestina e dalla fermata dell'autobus linee 051/508/555. Dista circa 3,5 km da Via Casilina e dalla METRO C fermata BORGHESIANA. Posizionato a circa 5 km dal casello autostradale della RM/NA entrata Monteporzio Catone , a circa 5 km dal GRA, dal Centro Commerciale di Roma Est e dal Casello Autostradale della A24. Contratto di affitto previsto: 6+6 Prezzo dell'affitto 900,00 Euro al mese. Se interessati saremo molto lieti di ricevervi presso la nostra agenzia per darvi maggiori informazioni sull'immobile o trovare altre soluzioni adatte alle vostre esigenze. STILE CASA SERVIZI IMMOBILIARI Tel. 06/2071107 - Via Bolognetta 1/L (Zona Finocchio) â€“ 00132 Roma 	Roma 	900 	 6 settembre, 06:19 	https://www.kijiji.it/annunci/affitto/roma-annunci-roma/affitto-locale-c1-mq-190-via-di-borghesiana/135276427	1365	{1364, 1365}	2
1644	Esquilino via Principe Umberto perfetto stato locale commerciale piano 	Rif: 50x (185025927) - Quartiere Esquilino e più precisamente via Principe Umberto locale commerciale ad uso negozio categoria catastale C1 avente superficie interna di metri quadrati 40 una luce su strada e dotato di due finestre interne con affaccio in chiostrina precedentemente restaurato ed attualmente in perfetto stato di manutenzione; è dotato inoltre di un bagno con finestra ed un antibagno altezza del solaio metri lineari 3,85 impiantistica tutta a norma impianto di video sorveglianza porta di ingresso anti intrusione; si presta come sala giochi internet point ludoteca o sala video lotterie. Si affitta solo a referenziati con contratto di locazione commerciale 6+6 prezzo richiesto euro 700 classe energetica G ag. imm.re 06/77204011-06/95599799 - Classe: G - IPE: 433.00 kWh/mc annum 	Roma 	700 	 15 luglio, 23:14 	https://www.kijiji.it/annunci/affitto/roma-annunci-roma/esquilino-via-principe-umberto-perfetto-stato-locale/140727510	1644	{1803, 1644}	2
2120	Gregorio vii 	GREGORIO VII Ad. San Pietro Proponiamo graziosa mansardina Semiarredata, composta da Soggiorno con angolo cottura, Camera, Bagno con doccia, Piccola Cabina armadio, Piccola Terrazzina con vista. L'' Immobile è dotato di aria condizionata. Euro 800 incluse tutte le spese e le utenze. Rif. Z-503 SI AFFITTA ESCLUSIVAMENTE AD INQUILINI REFERENZIATI ED IN POSSESSO DI UN REDDITO DOCUMENTATO Tel.06.53.55.67 www.ferrariemeriziola.it 	Roma 	800 	 3 marzo, 02:08 	https://www.kijiji.it/annunci/affitto/roma-annunci-roma/gregorio-vii/76931118	2120	{2120, 2255}	2
1797	Agrituriamo La Muratella rif. 504283 	La struttura si distingue per la tranquillità, il verde nel quale è immersa, pur essendo a pochi km da Roma e da Fiumicino, nonché dalla Fiera di Roma, dalle Terme di Qc Terme di Roma, da Ostia Antica e Fregene. Oltre al vicino mare di Fregene e di Maccarese, a pochi km dall'agriturismo si trovano un maneggio e le Terme dell'hotel Qc terme Roma, che offrono sconti in convenzione ai clienti della nostra struttura. La nostra struttura e' ideale per le famiglie, per il parco che offre ai bambini e la tranquillità del verde nel quale è immersa, ideale per rilassarsi dopo le gite in città. Classe energetica = Esente - Agriturismo La Muratella 	Eur / Portuense / Magliana 	Contatta l'utente 	 15 aprile, 09:29 	https://www.kijiji.it/annunci/affitto/roma-annunci-eur-portuense-magliana/agrituriamo-la-muratella-rif-504283/137172560	1797	{1797, 1798}	2
482	Prenestina/villa gordiani 	PRENESTINA adiacenze Largo Telese e Villa Gordiani, ottimamente collegato con il centro, grazie a 3 linee tram e 7 linee bus, proponiamo in locazione ad uso ufficio un grazioso trilocale non arredato ed in ottime condizioni interne, sito al piano terra di una un complesso immobiliare signorile. Si compone di ingresso con sala d''attesa, 2 camere, bagno con doccia, soppalco e balcone. Libero da subito uso studio. Richiesta euro 870,00. Solo referenziati. Rif. G-14 Tel. 06/700.88.92 www.ferrariemeriziola.it 	Roma 	870 	 12 febbraio, 00:13 	https://www.kijiji.it/annunci/affitto/roma-annunci-roma/prenestina-villa-gordiani/76035518	482	{482, 165}	2
2483	Trastevere 	Affittondita locale commerciale C/1 Trastevere Trilussa Via San Cosimato 1 vetrina su strada oltre 2 finestre possibilità di spazio esterno per tavoli e predisposizione canna fumaria euro 2.500,00 Per informazioni rivolgersi ad Immobili & Imprese srl tel. 06/5923798 	Roma 	2.500 	 14 febbraio, 21:38 	https://www.kijiji.it/annunci/affitto/roma-annunci-roma/trastevere/76196521	2483	{409, 2483}	2
445	Casal bernocchi 	Casalbernocchi adiacenze stazione Roma-Lido proponiamo in locazione un appartamento di ampia metratura posto in una palazzina bifamiliare. L''immobile si compone di ingresso tre camere matrimoniali cucina abitabile servizio un balcone di 12 mq ed uno di 5 mq. Termoautonomo si loca semi arredato. Cl.EN. G euro 800,00 rif.G-245 Tel.06/700.88.92 www.ferrariemeriziola.it 	Roma 	800 	 12 febbraio, 04:16 	https://www.kijiji.it/annunci/affitto/roma-annunci-roma/casal-bernocchi/76042241	445	{76, 445}	2
400	Garbatella 	GARBATELLA adiacente metro traversa della Circonvallazione Ostiense appartamentino in perfetto stato completamente ristrutturato ed ad arredato composto da un piccolo soggiorno con angolo cottura completamente attrezzato, camera, servizio con doccia e finestra, ampio balcone Euro 700,oo Rif. B-04 Tel. 06/5043347 www.ferrariemeriziola.it SI AFFITTA ESCLUSIVAMENTE AD INQUILINI REFERENZIATI ED IN POSSESSO DI UN REDDITO DOCUMENTABILE 	Roma 	650 	 12 febbraio, 11:29 	https://www.kijiji.it/annunci/affitto/roma-annunci-roma/garbatella/76064180	400	{400, 83}	2
860	Stanza uso ufficio zona gregorio vii di 16mq 	STANZA USO UFFICIO Zona GREGORIO VII di 16MQ non arredata disponibile dal 1 gennaio all'interno di Studio professionale tecnico un'ampia stanza luminosa uso ufficio; zona Gregorio VII via della Cava Aurelia (adiacente Stazione ferroviaria S. Pietro) stabile signorile E. 360,00 + spese accessorie (utenze+condominio). 	Roma 	360 	 27 settembre, 23:41 	https://www.kijiji.it/annunci/affitto/roma-annunci-roma/stanza-uso-ufficio-zona-gregorio-vii-di-16mq/131863182	860	{1156, 860}	2
382	Viale platone ad circonvalazione trionfale 	In strada privata con sbarra abbiamo incarico di locare appartamento finemente ristrutturato luminoso,così meglio descritto ingresso, soggiorno, camera, cucina, bagno con doccia,bagnetto di servizio, balcone. Posto auto nella strada con pass residenti. Contratto transitorio anni 1+1 solo referenziati. Per info Contattare 3396172549 Anna Rita Siliberto In the driveway with the bar I commissioned to lease renovated apartment bright, so better described entrance, living room, bedroom, kitchen, shower room, utility sink, balcony. Car parking in the street with residents pass. Term lease years 1 + 1 only referenced. E 950,00 For info Contact 3396172549 Anna Rita Siliberto 	Roma 	950 	 12 febbraio, 12:03 	https://www.kijiji.it/annunci/affitto/roma-annunci-roma/viale-platone-ad-circonvalazione-trionfale/76066006	382	{346, 382}	2
349	Monteverde Jenner locale C1 80mq. 3 vetrine su strada 	Monteverde Via Jenner in posizione centrale si cede locale commerciale C1 di 80 mq. ca. disposto su due livelli. Il locale si presenta in buone condizioni ristrutturato completamente cinque anni fà. La posizione su due fronti strada con tre ampie vetrine rende il locale ottimamente visibile. Il contratto di affitto ha una durata di ulteriori sei anni. 	Roma 	1.600 	 12 febbraio, 22:57 	https://www.kijiji.it/annunci/affitto/roma-annunci-roma/monteverde-jenner-locale-c1-80mq-3-vetrine-su-strada/76089236	349	{211, 349}	2
1050	Bilocale tutto ristrutturato zona metro B Bologna 	VIA LORENZO IL MAGNIFICO 86 Grande salone con angolo cottura 1 camera da letto completamente ristrutturato con aria condizionata bagno nuovo arredi nuovi piano terra no balconi no giardino No Agenzia, contattami per info via email : o su whatsapp Contratto regolare registrato transitorio SOLO per non residenti studenti lavoratori o altre esigenze transitorie - durata: Minimo 1 mese - Due mesi deposito cauzionale. 	Roma 	770 	 19 settembre, 07:48 	https://www.kijiji.it/annunci/affitto/roma-annunci-roma/bilocale-tutto-ristrutturato-zona-metro-b-bologna/120622866	1050	{1050, 1380}	2
347	Negozio 2 locali - Rif. 617-07G 	Monteverde Colli Portuensi in ottima posizione commerciale affittiamo un locale commerciale C1 di 50 mq. ca completamente su strada con due vetrine di esposizione. Contratto di locazione sei più sei. Il locale si presenta in ottime condizioni, completamente ristrutturato. Si affitta a referenziati. 	Roma 	3.700 	 12 febbraio, 22:58 	https://www.kijiji.it/annunci/affitto/roma-annunci-roma/negozio-2-locali-rif-617-07g/76089255	347	{347, 213}	2
345	Boccea Mattia Battistini App.to 80mq in locazione 	Boccea- Mattia Battistini e più precisamente il Largo Domenico Donzelli proponiamo in locazione appartamento finemente ristrutturato sito al secondo piano di quattro. L''appartamento, ad oggi adibito ad ufficio con impianto completamente cablato, sviluppa una superficie di ca 80mq e come da planimetrie allegate può essere locato sia come appartamento che come ufficio. Ipotesi 1 Ufficio: ingresso ampia sala, due studi, sala riunioni, un servizio e doppi balconi. Ipotesi 2 Abitazione: ingresso salone, cucina a vista, due camere matrimoniali, un bagno e doppi balconi. La posizione altamente strategica permette di avere tutti i servizi primari raggiungibili anche a piedi. La vicinanza alla metro permette di arrivare in centro in venti minuti e soprattutto di essere facilmente raggiunti. 	Roma 	980 	 12 febbraio, 22:58 	https://www.kijiji.it/annunci/affitto/roma-annunci-roma/boccea-mattia-battistini-app-to-80mq-in-locazione/76089267	345	{345, 212}	2
703	Camera in affitto nel quartiere San Lorenzo 	Camera in affitto in un appartamento nel quartiere San Lorenzo. Disponibile al prezzo di 600 € al mese! Contattaci menzionando il codice dell'annuncio: 131107. 	Centro Storico 	600 	 17 October, 05:40 	https://www.kijiji.it/annunci/affitto/roma-annunci-centro-storico/camera-in-affitto-nel-quartiere-san-lorenzo/144345497	703	{702, 703}	2
